abstract_text,authors,authors_orgn,download,journal,key,keywords,page,refer_key,title,url,year
"以现代沉积和野外露头理论模式为指导,对大庆长垣北部辨状河类型进行分析,确定了研究区葡I3小层为浅的砂质辫状河。并对辨状河心滩坝储层进行识别,建立了垂向序列、砂顶相对深度和砂体厚度分布三种识别标志,求得典型心滩坝与河道的定量规模,确定了研究区心滩坝和辫状河道呈""宽坝窄河道""样式分布,心滩坝长约600m~1000m,宽约400m~500m,单条辫状河道宽约80m。 ",高波|黄国华,大庆油田勘探开发研究院|大庆油田第一采油厂第三油矿,171,内蒙古石油化工,8aadf6c2-8413-11e8-ba8f-408d5c0cc128,大庆长垣|辨状河|心滩坝|辨状河道,2,67fed3f8-8413-11e8-aa1f-408d5c0cc128,大庆长垣辨状河心滩坝储层识别研究,http://rss.cnki.net/rss/Getinfobydoi.aspx?doi=CNKI:SUN:SYXB.0.2015-01-011,2011
"以羊三木油田羊三断块馆二上段为例,提出了辫状河砂体储层构型的研究方法,即基于辫状河露头及现代沉积原形模型,应用动、静态资料在井间识别单个心滩坝砂体,进行井间构型预测,建立构型三维展布模型。研究结果表明,辫状河心滩坝厚砂层内部存在次级界面,与界面伴生的夹层在心滩坝中心分布不稳定,剩余油往往富集于砂体顶部,而夹层在心滩坝两翼较为稳定,致使剩余油富集于被夹层分隔的某些相对均质段。 ",刘钰铭|侯加根|王连敏|薛建军|刘显贺|付晓亮,中国石油大学资源与信息学院|中石油大港油田分公司第六采油厂,3063,中国石油大学学报(自然科学版),8db01bb4-8413-11e8-beab-408d5c0cc128,储层构型|辫状河|心滩坝|剩余油|羊三木油田,6,67fed3f8-8413-11e8-aa1f-408d5c0cc128,辫状河储层构型分析,http://rss.cnki.net/rss/Getinfobydoi.aspx?doi=CNKI:SUN:SYXB.0.2015-01-011,2009
"应用河流砂体构型理论,首先识别出单个心滩坝,并对单个心滩坝进行构型解剖,建立了心滩坝的三维构型模型。从砂体构型的角度阐明了储集层初始含油气性差异的成因,解决了孔店油田馆陶组油水关系矛盾突出的问题。指出在厚砂体连片分布的单个沉积时间单元内,河道的侧向迁移可使不同期叠置砂体各自具有独立的流体系统;在同一河道内,心滩坝砂体与河道充填砂体之间的构型界面也会使不同成因砂体不完全连通,导致含油级别不同;同一成因砂体内部界面也能使界面上下含油饱和度及油水界面等存在较明显差异。 ",侯加根|刘钰铭|徐芳|张国一|王连敏|阎煜彪,中国石油大学(北京)|中国石油大港油田分公司,1150,古地理学报,8f68a2c8-8413-11e8-8f6d-408d5c0cc128,黄骅坳陷|孔店油田|辫状河|砂体构型|含油气性差异,6,67fed3f8-8413-11e8-aa1f-408d5c0cc128,黄骅坳陷孔店油田新近系馆陶组辫状河砂体构型及含油气性差异成因,http://rss.cnki.net/rss/Getinfobydoi.aspx?doi=CNKI:SUN:SYXB.0.2015-01-011,2008
"目前河流相储层构型研究主要侧重于露头和现代沉积,而地下储层构型分析及建模研究甚少,未形成有效的定量预测储层构型的方法,难以满足地下油藏剩余油分布预测的需要.为此,提出了层次约束、模式拟合和多维互动的地下储层构型分析与建模思路,并以济阳坳陷孤岛油田馆陶组曲流河储层为例,论述地下古河道储层构型的层次建模思路与方法.曲流河储层构型可分为3个层次,包括河道砂体层次、点坝层次和侧积体层次.将不同级次的定量构型模式与地下井资料(包括动态监测资料)分级别进行拟合,并且在分析过程中,使一维井眼、二维剖面和平面以及三维空间之间相互印证,从而建立不同层次的储层构型三维模型.同时,建立了活动河道宽度与点坝规模的定量关系,并应用水平井资料确定了侧积体和泥质侧积层的定量规模.这一研究不仅对地下地质学的发展具有重要的意义,而且对提高油田开发效益具有很大的实用价值. ",吴胜和|岳大力|刘建民|束青林|范峥|李宇鹏,中国石油大学(北京)资源与信息学院|中国石油化工股份有限公司胜利油田分公司|中国石油大学(北京)资源与信息学院 北京102249|山东257000|北京102249北京泰隆恒业高新技术公司|北京100085,2963,中国科学(D辑:地球科学),912d5e9e-8413-11e8-bef1-408d5c0cc128,储层构型|层次建模|曲流河|点坝|侧积体,11,67fed3f8-8413-11e8-aa1f-408d5c0cc128,地下古河道储层构型的层次建模研究,http://rss.cnki.net/rss/Getinfobydoi.aspx?doi=CNKI:SUN:SYXB.0.2015-01-011,2008
"以胜利油区孤东油田七区西为例,在沉积微相研究的基础上,主要应用研究区岩心、测井,动态等资料,对曲流河古河道砂体进行了系统的储层层次构型精细解剖。在点坝定量分布模式的指导下,根据点坝砂体垂向上典型的正韵律、砂体厚度大以及紧邻废弃河道分布等特征,在研究区Ng522单层复合河道砂体内部识别出2个单一点坝。综合露头和现代沉积的研究成果、经验公式预测以及对子井分析,建立了研究区点坝内部构型定量模式,以单井上识别的泥质侧积层作为依据,点坝内部定量模式及动态监测结果作为指导,进行模式拟合,达到系统解剖点坝内部构型的目的。建立了点坝内部泥质侧积层控制的剩余油分布模式,提出了采用在点坝砂体中上部钻水平井的方式开采侧积层控制的剩余油。点坝构型解剖成果在研究区得到了较好的应用效果,而且对类似油田储层精细研究及剩余分布预测都有较好的借鉴作用。 ",岳大力|吴胜和|谭河清|余地云|姜香云|刘世斌,中国石油大学(北京)资源与信息学院|中国石油化工股份有限公司胜利油田有限公司|中国石油化工股份有限公司胜利油田有限公司 北京102249|山东东营257000,2151,地学前缘,93034ba6-8413-11e8-b87c-408d5c0cc128,储层构型|剩余油|点坝|曲流河|孤东油田,9,67fed3f8-8413-11e8-aa1f-408d5c0cc128,曲流河古河道储层构型精细解剖――以孤东油田七区西馆陶组为例,http://rss.cnki.net/rss/Getinfobydoi.aspx?doi=CNKI:SUN:SYXB.0.2015-01-011,2008
"单砂体平面、层内(小层韵律性)非均质性已不能满足高含水期、三次采油阶段的需求,其既不能揭示单砂体内部物性空间变化及分布,更忽略了单砂体内非渗透薄夹层(多<30cm)对储层非均质性的影响。文中提出按反映单砂体成因、形成微过程及内部结构的储层建筑结构(architecture)研究单砂体内部三维非均质性的思想,并结合曲流点坝单一侧积体沉积模式及其侧叠模式,建立了""渗透率向凸岸、向上减小的新月形楔状侧积体,逐一斜列侧叠,其间被非渗透侧积薄夹层隔开""的曲流河道砂体""建筑结构控三维非均质模式"",揭示了以往忽视的、但对单砂体内部三维非均质性至关重要的不渗透薄夹层及其遮挡-阻流格架;也由此客观地揭示了单砂体内部物性基本单元(侧积砂体)及其三维分布规律,从而真正反映了单砂体内部三维非均质性的本质,并由此对单砂体内部渗流场、注入剂驱油和剩余油形成与分布产生重要影响,这将对高含水期、三次采油阶段及其以后的剩余油研究、预测具有重要意义。 ",马世忠|吕桂友|闫百泉|范广娟,大庆石油学院地球科学学院|大庆石油学院地球科学学院 黑龙江大庆163318|黑龙江大庆163318大庆职业学院|黑龙江大庆163255,1295,地学前缘,94a2f7de-8413-11e8-a06e-408d5c0cc128,储层建筑结构|三维非均质性|曲流河道|单砂体|层内非渗透薄夹层|侧积泥岩,8,67fed3f8-8413-11e8-aa1f-408d5c0cc128,河道单砂体“建筑结构控三维非均质模式”研究,http://rss.cnki.net/rss/Getinfobydoi.aspx?doi=CNKI:SUN:SYXB.0.2015-01-011,2008
"隔夹层是形成陆相储层流体流动非均质的主要原因之一,是控制厚油层复杂水淹形式的主要地质因素。研究结果表明,河流相储层隔夹层的成因类型可分为沉积作用形成的隔夹层及成岩作用形成的隔夹层两大类,隔夹层在注采井组范围内的分布状况对油水运动和最终采收率有很大的影响。隔夹层和其他因素共同作用可使厚油层出现多段水淹、强水淹段与未动用段共存的状态。隔夹层的存在有利于正韵律和块状韵律油层扩大纵向波及体积和驱油效率,不利于提高反韵律油层的注水波及效率。 ",束青林,中国石化胜利油田有限公司孤岛采油厂 山东东营257231,1241,石油学报,9645e79e-8413-11e8-902e-408d5c0cc128,孤岛油田|河流相储层|隔夹层|剩余油分布|辫状河|曲流河,4,67fed3f8-8413-11e8-aa1f-408d5c0cc128,孤岛油田馆陶组河流相储层隔夹层成因研究,http://rss.cnki.net/rss/Getinfobydoi.aspx?doi=CNKI:SUN:SYXB.0.2015-01-011,2006
"油田高含水开发后期 ,利用精细地质描述方法 ,根据丰富的密井网测井资料 ,借鉴古代河流砂体露头和现代河流沉积经验 ,对大庆喇嘛甸―萨尔图油田西部、河流相储层PⅠ2 砂岩组 ,进行精细对比、精细描述、模式预测等。表明PⅠ2 砂岩组的PⅠ2 3沉积单元为远源低弯度砂质辫状河沉积。通过岩心观察与描述 ,对结论进行了进一步证实。成果不仅解决了PⅠ2 砂岩组沉积单元精细划分与对比问题、澄清PⅠ2 3砂体成因类型上的认识 ,而且确认了大庆长垣萨、葡、高油层中、相对规模最大的砂质辫状河沉积。结果运用到生产实际中 ,对挖潜剩余油、改善开发效果 ,有很高的应用价值 ",刘波|赵翰卿|李广月|王良书|刘绍文,南京大学地球科学系|大庆油田公司勘探开发研究院|南京大学地球科学系 江苏南京210093|黑龙江大庆163712,806,石油学报,97f50c0a-8413-11e8-b24c-408d5c0cc128,识别|模式预测|储层描述|岩心观察|砂质辫状河|大庆油田,6,67fed3f8-8413-11e8-aa1f-408d5c0cc128,储层砂质辫状河的识别――以大庆喇嘛甸-萨尔图油田西部PⅠ23为例,http://rss.cnki.net/rss/Getinfobydoi.aspx?doi=CNKI:SUN:SYXB.0.2015-01-011,2002
"通过对曲流点坝形成过程、洪水事件的水动力条件及冲淤机制分析 ,结合大庆长垣曲流点坝垂向层序、侧积体类型与组成、岩石相、粒度、储油物性 ,建立了单一侧积体横向与垂向沉积模式和点坝侧积体沉积迭式 ,由此建立了点坝三维构形 ,进而对点坝砂体内部非均质控制格架、层次性、各级实体规律性、空间形态进行研究 ,建立三维非均质模型 ",马世忠|杨清彦,大庆石油学院勘探系!黑龙江省安达151400|大庆石油管理局勘探开发研究院!黑龙江大庆163712,1275,沉积学报,998d57cc-8413-11e8-b63a-408d5c0cc128,曲流点坝|侧积体沉积模式|岩相|非均质性,7,67fed3f8-8413-11e8-aa1f-408d5c0cc128,曲流点坝沉积模式、三维构形及其非均质模型,http://rss.cnki.net/rss/Getinfobydoi.aspx?doi=CNKI:SUN:SYXB.0.2015-01-011,2000
在大量野外工作基础上，总结了永定河（现代辫状河）的沉积特征：岩性粗，砂／泥比值高，具明显的正相序剖面特征；发育特征明显的落淤层；层理构造极为发育，类型却较为单调；辫状河砂体在时空上相互叠切，形成大面积分布的复合储集体。进而分析了辫状河相储集层的非均质特征，认为辫状河相储集层的层内和平面非均质性都很严重。在辫状河相沉积中可见到５个级次的沉积界面构造，即：一级冲刷面及二、三、四、五级沉积再作用面。提出了辫状河相储集层模式―――“泛连通体”，其砂体规模大、连通网络广布，局部通而不畅乃至连而不通。中国许多油田开发的动态信息证实，这种辫状河储集层地质模式是成立的，对指导有效注水开发辫状河相储集层具有普遍意义。图４参９（邹冬平摘） ,葛云龙|逯径铁|廖保方|李列|张为民|闻兰|薛培华|郭睿,华北石油职工大学|中国石油天然气集团公司石油勘探开发科学研究院,899,石油勘探与开发,9b39c558-8413-11e8-8e1b-408d5c0cc128,网状河|河流相|储集层|模型|注水,102k,67fed3f8-8413-11e8-aa1f-408d5c0cc128,辫状河相储集层地质模型――“泛连通体”,http://rss.cnki.net/rss/Getinfobydoi.aspx?doi=CNKI:SUN:SYXB.0.2015-01-011,1998
永定河是一条多河型河流，自上而下，包括了辩状河→曲流河→分流网状河的河型空间转换。其间辫状河段可明显区分为两类亚型：即冲积扇区的高坡降辫状河和冲积平原区低坡降辫状河。二者在河流形态、沉积物特征等方面显示不同。而沉积作用机制和砂体沉积模式是近似的，二者均进行垂向加积作用，均发生五个级次的沉积再作用面，均发育三个级次类型的薄夹层：滞留层、落淤层、颗粒降纹层与颗粒流纹层。其中落淤层最具指相意义。在河道经常摆动迁移过程中，最终形成砂体广泛展布的“叠覆泛砂体”。这种辫状河沉积模式──“叠覆泛砂体”为油气储集提供了良好的储集空间和场所。 ,廖保方|张为民|李列|逯径铁|葛云龙|闻兰|薛培华|郭睿,华北石油职工大学!河北固安|065506|石油勘探开发科学研究院!北京|100083|石油勘探开发科?,1749,沉积学报,9ce3b7a6-8413-11e8-8318-408d5c0cc128,高坡降辫状河|低坡降辫状河|落淤层|沉积模式|叠覆泛砂体,7,67fed3f8-8413-11e8-aa1f-408d5c0cc128,辫状河现代沉积研究与相模式──中国永定河剖析,http://rss.cnki.net/rss/Getinfobydoi.aspx?doi=CNKI:SUN:SYXB.0.2015-01-011,1998
籍家岭砂岩露头为松辽盆地东南隆起区的泉头组粗粒曲流河河道砂体。通过对该砂岩露头精细描述和沉积构形分析，阐明了粗粒曲流河砂体的内部构成。其岩性相类型有块状或层状砂砾岩相；槽状交错层理含砾中、粗砂岩相；板状交错层理含砾中、粗砂岩相；平行层理砂岩相；低角度交错层理砂岩相及泥砾岩相等，这６种岩性相构成了侧向加积砂坝、顺流加积砂坝、河道边部浅滩、滞留沉积及小冲沟冲刷充填物等五种构成要素。砂体内部可识别出四个级别的界面，其中三级界面明显地反映出砂体为三次河道强化过程的产物，且后期河道强化过程明显冲刷、改造了前期河道的沉积物。从而形成了粗粒曲流河砂体内部复杂的沉积构形。 ,辛仁臣|柳成志|雷顺,大庆石油学院石油勘探系|大庆采油一厂,336,大庆石油学院学报,9ffb4312-8413-11e8-8e4a-408d5c0cc128,沉积构形|岩性相|构成要素|河道砂体|泉头组,43k,67fed3f8-8413-11e8-aa1f-408d5c0cc128,粗粒曲流河体系河道沉积的沉积构形分析――以籍家岭泉头组露头为例,http://rss.cnki.net/rss/Getinfobydoi.aspx?doi=CNKI:SUN:SYXB.0.2015-01-011,1997
"目前油田使用的定量荧光录井中存在二维发射光谱单一峰值浓度的定量测量范围小、多次稀释增大了人为误差和浪费的问题。利用同步扫描荧光光谱技术,在10-4g/L至10g/L浓度范围内获取胜利油田原油样品在不同浓度下波长差为40nm的正己烷萃取液的同步光谱,发现不同的浓度下同步光谱不仅表现为峰高变化,峰位也有显著变化。选取了最具代表性的7个峰值,将光谱数据在非线性范围内进行多峰值的最小二乘法浓度响应函数拟合,多点同时定量,所得误差小于5%,重复率和准确率较高。图1表2参9 ",王春艳|邓美寅|杨晓明|张金亮|郑荣儿,中国海洋大学,146,石油勘探与开发,a2e3b6e8-8413-11e8-8ce1-408d5c0cc128,同步扫描荧光光谱技术|荧光录井|多点函数拟合|原油,3,,同步荧光光谱多点函数拟合确定原油样品浓度技术,http://rss.cnki.net/rss/Getinfobydoi.aspx?doi=CNKI:SUN:SKYK.0.2006-02-017,2006
"为了更好的发现轻质油和有效的消除特殊钻井条件下钻井液中大量混入有机添加剂对荧光录井的影响,国内外录井界都在尝试一种新的录井方法―――定量荧光录井技术。本文介绍了定量荧光录井技术产生的背景,检测原理和技术特点,重点介绍了定量荧光录井技术评价油水层的方法,通过近2年的试验性应用,定量荧光仪具有较高的检测灵敏度和较好的推广应用前景。 ",滕玉明|张书桐|邹军|高峰,胜利石油管理局地质录井公司|胜利石油管理局地质录井公司 山东东营　257064,183,山东地质,a5e9b918-8413-11e8-b4af-408d5c0cc128,定量荧光录井技术|储集层|评价方法|油气勘探|应用效果|山东|胜利油田,4,a2e3b6e8-8413-11e8-8ce1-408d5c0cc128,定量荧光录井技术在胜利油田油气勘探中的应用,http://rss.cnki.net/rss/Getinfobydoi.aspx?doi=CNKI:SUN:SKYK.0.2006-02-017,2003
"利用常规荧光检测仪进行荧光录井是识别油气层最方便易行的方法。以荧光检测仪为主线,系统回顾了定量荧光录井技术的发展历程,重点介绍了不同发展阶段定量荧光检测仪的结构原理、功能特点和应用情况,指出三维荧光检测仪将成为定量荧光录井的主流仪器,加强定量荧光录井资料的综合应用、开发定量荧光录井配套软件是定量荧光录井技术的发展趋势和今后努力的方向。 ",任中启,胜利石油管理局黄河钻井总公司钻井三公司 山东东营,307,钻井液与完井液,a79e0564-8413-11e8-ab47-408d5c0cc128,荧光检测仪|油气藏评价|综合录井|综述,397k,a2e3b6e8-8413-11e8-8ce1-408d5c0cc128,定量荧光录井技术的回顾与展望,http://rss.cnki.net/rss/Getinfobydoi.aspx?doi=CNKI:SUN:SKYK.0.2006-02-017,2003
"定量荧光录井对发现油显示 ,尤其是轻质油显示有着独到的作用。在室内实验和现场分析的基础上 ,文章对江苏油田不同断块、不同层位的储集层中不同性质的原油进行定量荧光分析 ,将荧光谱图中主峰波长、主峰荧光强度、油性指数确定为荧光谱图特征值。利用这些参数可发现储集层中不同性质的油显示及对储集层流体性质进行评价。 ",沈卫宏,江苏石油勘探局地质测井处 江都,96,石油仪器,a932535a-8413-11e8-a94c-408d5c0cc128,录井|定量荧光仪|油水层识别|主峰波长|荧光级别|油性指数,4,a2e3b6e8-8413-11e8-8ce1-408d5c0cc128,OFA-Ⅱ定量荧光仪及其应用,http://rss.cnki.net/rss/Getinfobydoi.aspx?doi=CNKI:SUN:SKYK.0.2006-02-017,2003
"利用原油及烃源岩抽提物中的芳烃在紫外光下能发荧光的特点 ,根据其荧光主峰波长及油性指数的差异判断原油性质 ,并且将荧光谱形、主峰位置及油性指数相结合 ,还可进行油油对比和油岩对比。这种新型的地球化学分析方法是利用荧光分析仪来完成的 ,方法简单、快速、准确 ,具有普遍推广的意义。 ",杨杰|陈丽华,中国地质大学|中国石油勘探开发研究院 (北京)中国石油勘探开发研究院,224,石油勘探与开发,aae465a8-8413-11e8-a00a-408d5c0cc128,分析方法|芳烃|荧光|主峰波长|荧光谱形|油性指数,3,a2e3b6e8-8413-11e8-8ce1-408d5c0cc128,利用荧光光谱进行原油测定及对比的方法,http://rss.cnki.net/rss/Getinfobydoi.aspx?doi=CNKI:SUN:SKYK.0.2006-02-017,2002
"定量荧光录井技术是近几年发展起来的一门录井新技术。由中国石油勘探开发研究院研制推广的OFA定量荧光分析仪可以进行定量荧光录井分析 ,增添了新的识别和评价油气层的手段 ,尤其在鉴别真假油气显示、发现轻质油、评价储集层、去除混油及钻井液添加剂对荧光录井的影响等方面 ,显示出优越的性能。介绍OFA定量荧光分析仪在河南油田的应用方法和应用成果 ,并对该项技术的推广应用提出了建议。图 5表 1参 1(苑淮摘 ) ",苑淮|张根法|常建军|吕文海,河南石油勘探局地质录井公司,97,石油勘探与开发,ac81350a-8413-11e8-904a-408d5c0cc128,定量荧光录井技术|油气层|OFA定量荧光分析仪|应用|河南油田,3,a2e3b6e8-8413-11e8-8ce1-408d5c0cc128,OFA定量荧光分析仪在河南油田的应用,http://rss.cnki.net/rss/Getinfobydoi.aspx?doi=CNKI:SUN:SKYK.0.2006-02-017,2002
"OFA系列石油荧光分析仪由中国石油勘探开发研究院与上海三科仪器有限公司合作研制开发 ,既能检测轻质油、凝析油、煤成油 ,反映各种原油样品的二维荧光全貌 ,又能实现较准确定量和排除钻井液添加剂荧光干扰 ,使用微机控制 ,数据处理自动化程度很高 ,是全新的现场用系列石油荧光分析仪。该类仪器检测石油的灵敏度为 0 .1mg/L ,重复性误差小于 3 % ,在石油含量小于 40mg/L时 ,R2 可达 0 .99以上 ,可以消除比测定目标石油浓度高 10倍以上的钻井液添加剂的荧光干扰 ,仪器的总体设计达到了国际先进水平。列举了用该类仪器在实验室和钻井现场测得的大量荧光数据和图谱 ,指出该仪器各项性能指标均优于传统的和国际上现有的荧光录井仪器与方法。图 5表 2参 2 ",赵菊英|杨杰|张宇|胡菊芳|王巍,中国石油勘探开发研究院|上海三科仪器有限公司|大港油田录井公司,166,石油勘探与开发,ae27a294-8413-11e8-b684-408d5c0cc128,石油|检测|荧光分析|仪表|灵敏度,6,a2e3b6e8-8413-11e8-8ce1-408d5c0cc128,OFA系列石油荧光分析仪,http://rss.cnki.net/rss/Getinfobydoi.aspx?doi=CNKI:SUN:SKYK.0.2006-02-017,2001
"由实验测定得知罗丹明B、丁基罗丹明B、曙红B组成的三组分混和荧光分析体系存在严重的荧光熄灭现象,其混和物的荧光光谱呈非线性,PLS难以校正.本文成功地将BP―ANN应用于此多元非线性荧光校正问题,完成了三组分的同时测定,得到了满意的结果.文中还定义了逼近度,并用于控制ANN训练中的过拟合现象,效果明显.结果表明BP―ANN是一种有效实用的多元非线性校正方法,为多组分混和物的荧光分析提供了一条新途径. ",梁逸曾|王素国|宋新华|俞汝勤|刘平,湖南大学化学计量学与化学传感技术研究所|常德师范高等专科学校化学系 长沙410082,154,化学学报,b1d7f124-8413-11e8-80af-408d5c0cc128,荧光分析|荧光熄灭|多元非线性校正|人工神经网络|化学计量学,7,a2e3b6e8-8413-11e8-8ce1-408d5c0cc128,多元非线性荧光校正的人工神经网络方法,http://rss.cnki.net/rss/Getinfobydoi.aspx?doi=CNKI:SUN:SKYK.0.2006-02-017,1997
"为了更好的发现轻质油和有效的消除特殊钻井条件下钻井液中大量混入有机添加剂对荧光录井的影响,国内外录井界都在尝试一种新的录井方法―――定量荧光录井技术。本文介绍了定量荧光录井技术产生的背景,检测原理和技术特点,重点介绍了定量荧光录井技术评价油水层的方法,通过近2年的试验性应用,定量荧光仪具有较高的检测灵敏度和较好的推广应用前景。 ",滕玉明|张书桐|邹军|高峰,胜利石油管理局地质录井公司|胜利石油管理局地质录井公司 山东东营　257064,183,山东地质,b4c48d46-8413-11e8-a82b-408d5c0cc128,定量荧光录井技术|储集层|评价方法|油气勘探|应用效果|山东|胜利油田,4,a2e3b6e8-8413-11e8-8ce1-408d5c0cc128,定量荧光录井技术在胜利油田油气勘探中的应用,http://rss.cnki.net/rss/Getinfobydoi.aspx?doi=CNKI:SUN:SKYK.0.2006-02-017,2003
"利用常规荧光检测仪进行荧光录井是识别油气层最方便易行的方法。以荧光检测仪为主线,系统回顾了定量荧光录井技术的发展历程,重点介绍了不同发展阶段定量荧光检测仪的结构原理、功能特点和应用情况,指出三维荧光检测仪将成为定量荧光录井的主流仪器,加强定量荧光录井资料的综合应用、开发定量荧光录井配套软件是定量荧光录井技术的发展趋势和今后努力的方向。 ",任中启,胜利石油管理局黄河钻井总公司钻井三公司 山东东营,307,钻井液与完井液,b6485c34-8413-11e8-8b08-408d5c0cc128,荧光检测仪|油气藏评价|综合录井|综述,397k,a2e3b6e8-8413-11e8-8ce1-408d5c0cc128,定量荧光录井技术的回顾与展望,http://rss.cnki.net/rss/Getinfobydoi.aspx?doi=CNKI:SUN:SKYK.0.2006-02-017,2003
"定量荧光录井对发现油显示 ,尤其是轻质油显示有着独到的作用。在室内实验和现场分析的基础上 ,文章对江苏油田不同断块、不同层位的储集层中不同性质的原油进行定量荧光分析 ,将荧光谱图中主峰波长、主峰荧光强度、油性指数确定为荧光谱图特征值。利用这些参数可发现储集层中不同性质的油显示及对储集层流体性质进行评价。 ",沈卫宏,江苏石油勘探局地质测井处 江都,96,石油仪器,b7d0106c-8413-11e8-aa6d-408d5c0cc128,录井|定量荧光仪|油水层识别|主峰波长|荧光级别|油性指数,4,a2e3b6e8-8413-11e8-8ce1-408d5c0cc128,OFA-Ⅱ定量荧光仪及其应用,http://rss.cnki.net/rss/Getinfobydoi.aspx?doi=CNKI:SUN:SKYK.0.2006-02-017,2003
