abstract_text,authors,authors_orgn,download,journal,key,keywords,page,refer_key,title,url,year
"通过14口取心井普通薄片、铸体薄片的镜下观察及扫描电镜等资料的研究,认为影响下二门油田碎屑岩储层的成岩作用主要有3种:压实、胶结和溶蚀。其中,压实作用以机械压实为主,化学压实少见;胶结作用主要有碳酸盐胶结(如方解石、白云石等)、黏土矿物胶结(如高岭石、绿泥石等);溶蚀作用主要有长石颗粒和少部分岩屑溶蚀、碳酸盐胶结物溶蚀。这3种成岩作用的共同改造形成了下二门油田以粒间孔、粒内溶孔和铸模孔为主的孔隙结构特征。根据微观孔隙结构特征,结合沉积相展布特点,认为下二门油田有利储层主要分布在辫状三角洲前缘亚相带水下分流河道和前缘砂坝等砂体。这些新认识为该油田调整挖潜提供了地质指导。 ",谢俊|孟宁宁|张金亮|姜建伟|曾俊,山东省沉积成矿作用与沉积矿产重点实验室|山东科技大学地质学院|北京师范大学资源学院|中国石化河南油田分公司勘探开发研究院,312,中国海洋大学学报(自然科学版),c91f0fac-8411-11e8-ba7c-408d5c0cc128,下二门油田|成岩作用|孔隙结构|储层特征,5,,下二门油田储层成岩作用类型及微观孔隙结构特征,http://rss.cnki.net/rss/Getinfobydoi.aspx?doi=CNKI:SUN:QDHY.0.2012-Z1-018,2012
"华池油田华152区长3油层组储层以粉细粒长石砂岩、岩屑长石砂岩为主,发育多种孔隙类型,主要有粒间溶孔、粒内溶孔、剩余粒间孔、晶间微孔隙和构造缝,其中粒间溶孔是长3油层组储层的主要孔隙类型。主要成岩矿物为伊利石、绿泥石、伊/蒙混层、高岭石、方解石、白云石、石英等。根据成岩作用的矿物岩石学标志,将研究区成岩阶段界定为中成岩A期。压实和胶结作用破坏了砂岩的原生孔隙结构,而溶蚀作用形成次生孔隙,有效地改善了砂岩的孔隙结构。 ",李群|郭建华|郭宇航,中南大学地学与环境工程学院|中南大学地学与环境工程学院 湖南长沙410083,156,沉积与特提斯地质,ccf3d61a-8411-11e8-bbee-408d5c0cc128,孔隙结构|成岩作用|成岩模式|储层性质|华池油田,6,c91f0fac-8411-11e8-ba7c-408d5c0cc128,华池油田华152区长3油层组砂岩的成岩作用与孔隙演化,http://rss.cnki.net/rss/Getinfobydoi.aspx?doi=CNKI:SUN:QDHY.0.2012-Z1-018,2008
"根据砂岩薄片、铸体薄片、扫描电镜、X-衍射分析,研究了鄂尔多斯盆地西峰油田镇北地区长3储层的成岩作用特征,认为该区长3储层处于晚成岩A期阶段,压实作用和胶结作用强烈地破坏了砂岩的原生孔隙结构,溶蚀作用和破裂作用则有效地改善了砂岩的孔隙结构。该区长3储层发育溶蚀作用相、压实作用相、胶结作用相和自生绿泥石胶结残余孔隙相,储层成岩相发育状况决定了孔隙结构的发育特征。发育次生孔隙相和残余孔隙相的砂岩具有较好的孔隙结构,孔渗较高;压实作用相和胶结作用相发育的砂岩具有很差的孔隙结构,孔渗很低。 ",刘林玉|王震亮|张龙,西北大学大陆动力学重点实验室西北大学地质系|西北大学大陆动力学重点实验室西北大学地质系 西安710069,818,沉积学报,cf350dac-8411-11e8-90dc-408d5c0cc128,成岩作用|成岩相|孔隙结构|镇北地区|鄂尔多斯盆地,8,c91f0fac-8411-11e8-ba7c-408d5c0cc128,鄂尔多斯盆地镇北地区长3砂岩的成岩作用及其对储层的影响,http://rss.cnki.net/rss/Getinfobydoi.aspx?doi=CNKI:SUN:QDHY.0.2012-Z1-018,2006
"通过油田后期钻井,对下二门油田局部地质构造进行了重新认识,完善了构造的分区,发现了新 的含油区块,实现了增储增产。 ",张廷鹏|张廷飞|孙秀英|康玲珍|郑立莲|石莉莉|张君,河南油田分公司第一采油厂|河南油田分公司第一采油厂 河南 桐柏 474780,65,石油天然气学报(江汉石油学院学报),d0d631ca-8411-11e8-b9c2-408d5c0cc128,下二门油田|地质构造|含油气性|增储增产,2,c91f0fac-8411-11e8-ba7c-408d5c0cc128,下二门油田局部地质构造再认识,http://rss.cnki.net/rss/Getinfobydoi.aspx?doi=CNKI:SUN:QDHY.0.2012-Z1-018,2005
二门油田经过近２０年的注水开发，目前已进入高含水后期开采，由于该油田储层矿物及胶结物组分成熟度低，不稳定矿物和易溶解胶结物含量高，因此注入水的长期冲刷对储层物性及其它渗流特征参数影响较大，主要表现在：开发后期储层类型增多；孔隙和喉道的分布及组合配置关系更加多样化；大孔（喉）道与小孔（喉）道出现的频率和变化幅度在微观上表现出极大的差异性；相对渗透率参数变化范围加大且曲线类型更加复杂；油层润湿性、驱油效率及剩余油分布特征也发生相应的变化，使得储层非均质性更为严重，开采难度加大，常规“控水稳油””措施受阻。成果采用对比井分析、室内岩心物模实验、测井解释、动态分析、电子探针、敏感性评价等技术对注水开发后期储层特征进行详细探讨，其研究思路、方法和技术可在中国东部砂砾岩油藏储层评价中推广使用。 ,赵跃华|赵新军|翁大丽|台怀忠,河南石油勘探局勘探开发研究院,360,石油学报,d2611dd0-8411-11e8-a64b-408d5c0cc128,注水开发|后期|储层|非均质性|剩余油分布,183k,c91f0fac-8411-11e8-ba7c-408d5c0cc128,注水开发后期下二门油田储层特征,http://rss.cnki.net/rss/Getinfobydoi.aspx?doi=CNKI:SUN:QDHY.0.2012-Z1-018,1999
"华池油田华152区长3油层组储层以粉细粒长石砂岩、岩屑长石砂岩为主,发育多种孔隙类型,主要有粒间溶孔、粒内溶孔、剩余粒间孔、晶间微孔隙和构造缝,其中粒间溶孔是长3油层组储层的主要孔隙类型。主要成岩矿物为伊利石、绿泥石、伊/蒙混层、高岭石、方解石、白云石、石英等。根据成岩作用的矿物岩石学标志,将研究区成岩阶段界定为中成岩A期。压实和胶结作用破坏了砂岩的原生孔隙结构,而溶蚀作用形成次生孔隙,有效地改善了砂岩的孔隙结构。 ",李群|郭建华|郭宇航,中南大学地学与环境工程学院|中南大学地学与环境工程学院 湖南长沙410083,156,沉积与特提斯地质,d58cbb48-8411-11e8-8969-408d5c0cc128,孔隙结构|成岩作用|成岩模式|储层性质|华池油田,6,c91f0fac-8411-11e8-ba7c-408d5c0cc128,华池油田华152区长3油层组砂岩的成岩作用与孔隙演化,http://rss.cnki.net/rss/Getinfobydoi.aspx?doi=CNKI:SUN:QDHY.0.2012-Z1-018,2008
"根据砂岩薄片、铸体薄片、扫描电镜、X-衍射分析,研究了鄂尔多斯盆地西峰油田镇北地区长3储层的成岩作用特征,认为该区长3储层处于晚成岩A期阶段,压实作用和胶结作用强烈地破坏了砂岩的原生孔隙结构,溶蚀作用和破裂作用则有效地改善了砂岩的孔隙结构。该区长3储层发育溶蚀作用相、压实作用相、胶结作用相和自生绿泥石胶结残余孔隙相,储层成岩相发育状况决定了孔隙结构的发育特征。发育次生孔隙相和残余孔隙相的砂岩具有较好的孔隙结构,孔渗较高;压实作用相和胶结作用相发育的砂岩具有很差的孔隙结构,孔渗很低。 ",刘林玉|王震亮|张龙,西北大学大陆动力学重点实验室西北大学地质系|西北大学大陆动力学重点实验室西北大学地质系 西安710069,818,沉积学报,d75813c6-8411-11e8-9525-408d5c0cc128,成岩作用|成岩相|孔隙结构|镇北地区|鄂尔多斯盆地,8,c91f0fac-8411-11e8-ba7c-408d5c0cc128,鄂尔多斯盆地镇北地区长3砂岩的成岩作用及其对储层的影响,http://rss.cnki.net/rss/Getinfobydoi.aspx?doi=CNKI:SUN:QDHY.0.2012-Z1-018,2006
"通过油田后期钻井,对下二门油田局部地质构造进行了重新认识,完善了构造的分区,发现了新 的含油区块,实现了增储增产。 ",张廷鹏|张廷飞|孙秀英|康玲珍|郑立莲|石莉莉|张君,河南油田分公司第一采油厂|河南油田分公司第一采油厂 河南 桐柏 474780,65,石油天然气学报(江汉石油学院学报),d8e9b268-8411-11e8-8d26-408d5c0cc128,下二门油田|地质构造|含油气性|增储增产,2,c91f0fac-8411-11e8-ba7c-408d5c0cc128,下二门油田局部地质构造再认识,http://rss.cnki.net/rss/Getinfobydoi.aspx?doi=CNKI:SUN:QDHY.0.2012-Z1-018,2005
"安塞地区长2油层储层以中细粒长石砂岩为主,主要成岩矿物为绿泥石环边、方解石胶结物、石英和长石加大生长、伊利石、伊-蒙混层、钠长石和高岭石等。绿泥石环边的发育对原生粒间孔的保存起到有利的作用。石英加大级别达 级,加大边含有丰富的有机包体,均一温度范围48.1～76.5oC,烃类进入储层的时间为早白垩世中期至晚白垩世。储层发育多种孔隙类型,面孔率平均为11.60%,主要类型有粒间孔、骨架颗粒溶孔和微裂缝等。残余粒间孔和骨架颗粒溶孔是本区长2储层的主要孔隙类型。根据成岩作用的矿物岩石学标志、有机质成熟度及古温度,将长2油层砂岩的成岩作用划分为3个成岩阶段:早成岩阶段、晚成岩阶段和表生成岩阶段。储层性质明显地受到沉积微相和成岩作用的影响,沉积物粒度较粗、厚度较大的分流河道储集物性明显优于各种粒度较细、厚度较薄的分流间席状砂体。 ",张金亮|梁杰|杜桂林,中国海洋大学海洋地球科学学院|中国海洋大学海洋地球科学学院 山东青岛　266003,442,西北地质,db1eec08-8411-11e8-9c2d-408d5c0cc128,安塞油田|绿泥石环边|有机包裹体|次生孔隙|成岩模式|储层性质,9,c91f0fac-8411-11e8-ba7c-408d5c0cc128,安塞油田长2油层成岩作用及其对储层物性的影响,http://rss.cnki.net/rss/Getinfobydoi.aspx?doi=CNKI:SUN:QDHY.0.2012-Z1-018,2004
"准噶尔盆地东部下侏罗统三工河组孔隙类型 :主要有剩余原生粒间孔和次生孔隙。剩余原生粒间孔是成岩早期淀粘土及石英加大形成的 ,它们围绕碎屑边部分布。本地区 ,在剩余原生粒间孔发育的基础上、发生溶蚀作用 ,形成一些原生扩大孔 ,超大孔、粒内溶孔等。成岩早期胶结作用形成剩余原生粒间孔 ,晚期的溶蚀作用形成次生孔隙。 ",张丽霞|李民,新疆石油管理局准东勘探开发研究所!阜康市831511,223,矿物岩石,dd023128-8411-11e8-9ff4-408d5c0cc128,准噶尔盆地|成岩作用|孔隙,5,c91f0fac-8411-11e8-ba7c-408d5c0cc128,准东下侏罗统三工河组砂岩成岩作用及其对孔隙的影响,http://rss.cnki.net/rss/Getinfobydoi.aspx?doi=CNKI:SUN:QDHY.0.2012-Z1-018,2000
二门油田经过近２０年的注水开发，目前已进入高含水后期开采，由于该油田储层矿物及胶结物组分成熟度低，不稳定矿物和易溶解胶结物含量高，因此注入水的长期冲刷对储层物性及其它渗流特征参数影响较大，主要表现在：开发后期储层类型增多；孔隙和喉道的分布及组合配置关系更加多样化；大孔（喉）道与小孔（喉）道出现的频率和变化幅度在微观上表现出极大的差异性；相对渗透率参数变化范围加大且曲线类型更加复杂；油层润湿性、驱油效率及剩余油分布特征也发生相应的变化，使得储层非均质性更为严重，开采难度加大，常规“控水稳油””措施受阻。成果采用对比井分析、室内岩心物模实验、测井解释、动态分析、电子探针、敏感性评价等技术对注水开发后期储层特征进行详细探讨，其研究思路、方法和技术可在中国东部砂砾岩油藏储层评价中推广使用。 ,赵跃华|赵新军|翁大丽|台怀忠,河南石油勘探局勘探开发研究院,360,石油学报,de87de98-8411-11e8-bb49-408d5c0cc128,注水开发|后期|储层|非均质性|剩余油分布,183k,c91f0fac-8411-11e8-ba7c-408d5c0cc128,注水开发后期下二门油田储层特征,http://rss.cnki.net/rss/Getinfobydoi.aspx?doi=CNKI:SUN:QDHY.0.2012-Z1-018,1999
"通过对东濮凹陷文79块沙二下亚段测井资料分析,综合岩心、地震资料,并引入最大熵谱分析技术,将东濮凹陷文79块沙二下亚段划分为2个长期基准面旋回LSC1-LSC2、6个中期基准面旋回MSC1-MSC6,以及58个短期基准面旋回。应用旋回等时对比技术,选取中期旋回作为对比骨架,建立东濮凹陷文79地区沙二下亚段层序地层格架。同时,对层序格架内沉积相进行分析,确定研究区为分支河体系的曲流河扇沉积,归纳层序格架内砂体发育与展布的特点。结果显示:LSC1为基准面下降半旋回,自下往上A/S(Accommodation/Sediments)比值减小,可容纳空间逐渐减小,河道/漫岸比值增加,砂体连通性变好;LSC2为基准面上升半旋回,自下往上A/S比值增加,可容纳空间逐渐增大,河道/漫岸比值减小,砂体连通性变差。 ",薛欢欢|张金亮|李景哲|孙中强|于涛|王广群,山东科技大学地球科学与工程学院|北京师范大学资源学院,119,中国科技论文,e1669b2c-8411-11e8-8317-408d5c0cc128,东濮凹陷|文79区块|沙河街组|层序地层格架|沉积相分布,5,,东濮凹陷文79块沙二下亚段高分辨率层序地层结构模型研究,http://rss.cnki.net/rss/Getinfobydoi.aspx?doi=CNKI:SUN:ZKZX.0.2015-15-004,2015
"针对目前地层划分、对比存在人为性、多解性等问题,首先仔细分析了野外露头与岩心的沉积序列特点,研究了地层的叠置序列与旋回结构;进而建立了相应的地质模型,通过地质模型把地层的旋回结构转化成数值模拟信号;最后根据信号特征,提出了综合预测误差滤波分析方法,并研究出该方法的原理、步骤、功能。在此基础上,利用该方法对模拟信号进行处理分析,提取出反映地层叠置及旋回结构的频谱趋势线,并搞清频率趋势线的地质意义乃间接反映了当时的沉积环境及基准面变化过程。由此,可以找出反映同一等时地层界面的拐点及变化趋势,根据拐点及变化趋势完成了地层的等时对比。这为地层精确划分及真正意义上的等时对比奠定了基础。通过对实际测井数据的处理,验证了该方法的有效性。 ",刘洛夫|徐敬领|高鹏|邹长春|王远征|徐新宇,中国石油大学 油气资源与探测国家重点实验室|中国石油大学地球科学学院|中国地质大学 地下信息探测技术与仪器教育部重点实验室|中国地质大学地球物理与信息技术院|中国石油大庆油田有限责任公司第二采油厂地质大队|中国石油冀东油田公司陆上油田作业区工艺研究所|中国石油海外勘探开发分公司,224,石油与天然气地质,e4f8d8b6-8411-11e8-865a-408d5c0cc128,测井数据|滤波分析|等时对比|地层划分,9,e1669b2c-8411-11e8-8317-408d5c0cc128,综合预测误差滤波分析方法在地层划分及等时对比中的应用,http://rss.cnki.net/rss/Getinfobydoi.aspx?doi=CNKI:SUN:ZKZX.0.2015-15-004,2013
"通过对研究区300多口钻井的地层对比和3 000多米岩心的详细观察及区域构造-沉积演化分析,综合运用构造、古生物、岩性、地质年代以及测井和地震反射等6个方面的特征,将东濮凹陷古近系划分为3个超长期层序,分别对应于沙河街组四段下亚段、沙河街组四段上亚段―沙河街组三段、沙河街组二段―东营组;并将沙河街组四段上亚段―沙河街组一段划分为4个长期层序,分别对应于沙河街组四段上亚段―沙河街组三段四亚段、沙河街组三段三亚段、沙河街组三段二亚段―沙河街组三段一亚段、沙河街组二段―沙河街组一段。提出同一套连续沉积的盐岩在长期及超长期层序划分中具不可分割性,并结合东濮凹陷及渤海湾盆地层序划分的实例,指出目前普遍存在的层序地层划分方案与岩石地层划分方案相一致的现象值得商榷。 ",高红灿|郑荣才|陈发亮|韩福民|刘云,"中国石化中原油田博士后科研工作站|中国石化中原油田分公司物探研究院|成都理工大学""油气藏地质及开发工程""国家重点实验室",1045,石油与天然气地质,e6e2bb52-8411-11e8-a284-408d5c0cc128,层序地层|沙河街组|古近系|东濮凹陷|渤海湾盆地,12,e1669b2c-8411-11e8-8317-408d5c0cc128,渤海湾盆地东濮凹陷古近系沙河街组层序地层,http://rss.cnki.net/rss/Getinfobydoi.aspx?doi=CNKI:SUN:ZKZX.0.2015-15-004,2011
"运用基准面旋回原理,通过岩心、录井、测井和地震资料的综合分析,在东濮凹陷文南油田文138井沙二段下亚段中识别出3种基本结构类型和7个亚类型的短期基准面旋回层序。其中,向上""变深""的非对称型主要发育在距物源区较近或物源供给较充分的三角洲前缘中的分流水道、河道间湾沉积区;向上""变浅""的非对称型发育在距物源供给区相对较远但供给量逐渐增多的三角洲前缘中的河口坝、远砂坝沉积区;向上""变深""复""变浅""的对称型往往发育于沉积速率始终小于可容纳空间增长率的三角州前缘区。研究结果表明,文138井沙二段下亚段发育中期基准面旋回(4级)14个,短期旋回(5级)40个,超短期旋回(6级)92个;单个中期基准面旋回的厚度一般为18~32m,单个超短期旋回的厚度平均为4m。 ",黄捍东|彭勇民|罗群,中国石油大学(北京)CNPC物探重点实验室|中国石油大学(北京)CNPC物探重点实验室 北京102200,184,油气地质与采收率,e8bfdef8-8411-11e8-be1d-408d5c0cc128,超短期旋回|高分辨率层序地层|沙二段下亚段|东濮凹陷,6,e1669b2c-8411-11e8-8317-408d5c0cc128,东濮凹陷文南油田文138断块沙二段下亚段层序地层,http://rss.cnki.net/rss/Getinfobydoi.aspx?doi=CNKI:SUN:ZKZX.0.2015-15-004,2007
高分辨率的等时地层对比的关键是识别地层记录中代表多级次的基准面破回的多级次的地层旋回。每一级次的地层旋回内必然存在着能反映相应级次基准面旋回所经历时间的痕迹，其沉积和地层特征主要为：（１）单一相物理性质的垂向变化；（２）相序和相组合变化；（３）旋回叠加样式的改变；（４）地层几何形态与接触关系。这些特征均反映可容纳空间和沉积物补给通量比值（Ａ／Ｓ）的变化。露头剖面、钻井剖面具有较高的分辩率，是高级次旋回识别的基础，可识别短期基准面旋回；测井曲线基准面旋回的确定，是在建立测井响应模型的基础上根据短期旋回的叠加样式识别中期基准面旋回；地震剖面由于受分辨率的限制只能识别中长期基准面旋回。基准面旋回的转换点，可作为高分辨率等时地层对比的优选位置，即基准面旋回的二分时间单元的划分界线。时间－空间图解是对地层剖面进行时间－空间反演的最有效方法，有助于检验层序对比的可靠性。几个具体应用实例说明，基准面旋回识别和旋回等时地层对比技术虽源于海相地层，但在非海相地层中，其原理和方法仍然适用。 ,邓宏文|王洪亮|李熙,中国地质大学|北京石油勘探开发科学研究院,3220,石油与天然气地质,ea4ba9b4-8411-11e8-9e46-408d5c0cc128,层序地层|基准面旋回|识别|对比技术|等时对比|应用,429k,e1669b2c-8411-11e8-8317-408d5c0cc128,层序地层地层基准面的识别、对比技术及应用,http://rss.cnki.net/rss/Getinfobydoi.aspx?doi=CNKI:SUN:ZKZX.0.2015-15-004,1996
以科罗拉多Ｔ．Ａ．Ｃｒｏｓｓ成因地层研究组为代表的高分辨率层序地层学问世后，立即得到学术及实业界有识人士的高度重视，实际应用效果显著，这标志着层序地层学的新发展。高分辨率层序地层学着眼于沉积矿产，特别是油气勘探中具体目标的精确预测。以地层过程一响应沉积动力学为理论基础，具体有四，即：地层基准面原理、体积划分原理、相分异原理与旋回等时对比法则。油气勘探开发实践证明，该方法对相分布、储层三维预测、流体流动数值模拟物理模式的建立有着重要意义。 ,邓宏文,中国地质大学,3559,石油与天然气地质,ebdbb322-8411-11e8-8663-408d5c0cc128,高分辨率|层序地层学|基准面|体积划分|相分异|等时对比,474k,e1669b2c-8411-11e8-8317-408d5c0cc128,美国层序地层研究中的新学派──高分辨率层序地层学,http://rss.cnki.net/rss/Getinfobydoi.aspx?doi=CNKI:SUN:ZKZX.0.2015-15-004,1995
"针对目前地层划分、对比存在人为性、多解性等问题,首先仔细分析了野外露头与岩心的沉积序列特点,研究了地层的叠置序列与旋回结构;进而建立了相应的地质模型,通过地质模型把地层的旋回结构转化成数值模拟信号;最后根据信号特征,提出了综合预测误差滤波分析方法,并研究出该方法的原理、步骤、功能。在此基础上,利用该方法对模拟信号进行处理分析,提取出反映地层叠置及旋回结构的频谱趋势线,并搞清频率趋势线的地质意义乃间接反映了当时的沉积环境及基准面变化过程。由此,可以找出反映同一等时地层界面的拐点及变化趋势,根据拐点及变化趋势完成了地层的等时对比。这为地层精确划分及真正意义上的等时对比奠定了基础。通过对实际测井数据的处理,验证了该方法的有效性。 ",刘洛夫|徐敬领|高鹏|邹长春|王远征|徐新宇,中国石油大学 油气资源与探测国家重点实验室|中国石油大学地球科学学院|中国地质大学 地下信息探测技术与仪器教育部重点实验室|中国地质大学地球物理与信息技术院|中国石油大庆油田有限责任公司第二采油厂地质大队|中国石油冀东油田公司陆上油田作业区工艺研究所|中国石油海外勘探开发分公司,224,石油与天然气地质,f2afa534-8411-11e8-ad0f-408d5c0cc128,测井数据|滤波分析|等时对比|地层划分,9,e1669b2c-8411-11e8-8317-408d5c0cc128,综合预测误差滤波分析方法在地层划分及等时对比中的应用,http://rss.cnki.net/rss/Getinfobydoi.aspx?doi=CNKI:SUN:ZKZX.0.2015-15-004,2013
"通过对研究区300多口钻井的地层对比和3 000多米岩心的详细观察及区域构造-沉积演化分析,综合运用构造、古生物、岩性、地质年代以及测井和地震反射等6个方面的特征,将东濮凹陷古近系划分为3个超长期层序,分别对应于沙河街组四段下亚段、沙河街组四段上亚段―沙河街组三段、沙河街组二段―东营组;并将沙河街组四段上亚段―沙河街组一段划分为4个长期层序,分别对应于沙河街组四段上亚段―沙河街组三段四亚段、沙河街组三段三亚段、沙河街组三段二亚段―沙河街组三段一亚段、沙河街组二段―沙河街组一段。提出同一套连续沉积的盐岩在长期及超长期层序划分中具不可分割性,并结合东濮凹陷及渤海湾盆地层序划分的实例,指出目前普遍存在的层序地层划分方案与岩石地层划分方案相一致的现象值得商榷。 ",高红灿|郑荣才|陈发亮|韩福民|刘云,"中国石化中原油田博士后科研工作站|中国石化中原油田分公司物探研究院|成都理工大学""油气藏地质及开发工程""国家重点实验室",1045,石油与天然气地质,f4715024-8411-11e8-a131-408d5c0cc128,层序地层|沙河街组|古近系|东濮凹陷|渤海湾盆地,12,e1669b2c-8411-11e8-8317-408d5c0cc128,渤海湾盆地东濮凹陷古近系沙河街组层序地层,http://rss.cnki.net/rss/Getinfobydoi.aspx?doi=CNKI:SUN:ZKZX.0.2015-15-004,2011
"运用基准面旋回原理,通过岩心、录井、测井和地震资料的综合分析,在东濮凹陷文南油田文138井沙二段下亚段中识别出3种基本结构类型和7个亚类型的短期基准面旋回层序。其中,向上""变深""的非对称型主要发育在距物源区较近或物源供给较充分的三角洲前缘中的分流水道、河道间湾沉积区;向上""变浅""的非对称型发育在距物源供给区相对较远但供给量逐渐增多的三角洲前缘中的河口坝、远砂坝沉积区;向上""变深""复""变浅""的对称型往往发育于沉积速率始终小于可容纳空间增长率的三角州前缘区。研究结果表明,文138井沙二段下亚段发育中期基准面旋回(4级)14个,短期旋回(5级)40个,超短期旋回(6级)92个;单个中期基准面旋回的厚度一般为18~32m,单个超短期旋回的厚度平均为4m。 ",黄捍东|彭勇民|罗群,中国石油大学(北京)CNPC物探重点实验室|中国石油大学(北京)CNPC物探重点实验室 北京102200,184,油气地质与采收率,f6382d74-8411-11e8-b94f-408d5c0cc128,超短期旋回|高分辨率层序地层|沙二段下亚段|东濮凹陷,6,e1669b2c-8411-11e8-8317-408d5c0cc128,东濮凹陷文南油田文138断块沙二段下亚段层序地层,http://rss.cnki.net/rss/Getinfobydoi.aspx?doi=CNKI:SUN:ZKZX.0.2015-15-004,2007
