abstract_text,authors,authors_orgn,download,journal,key,keywords,page,refer_key,title,url,year
"<正> 马粪海胆（Hemicentrotus pulcherrimus）是一种经济海产动物,它的生殖腺营养极为丰富,我国明代就有利用海胆生殖腺制酱的记载。由于马粪海胆的生殖腺色泽橙红,因此是加工高级“云丹”的优质原料。此外,海胆的提取物”波乃利宁”（Bonellinin）具有抑制癌细胞生长的作用,因此可以作为研究抗癌药物的材料。据报道,苏联有关学者最近对海胆生殖腺作了测定和分析,认为海胆生殖腺所含的二十烷酸(C19H39COOH) ",廖承义,山东海洋学院海洋生物学系,98,山东海洋学院学报,5d2c11e4-8417-11e8-852e-408d5c0cc128,,11,4a14bc54-8417-11e8-8e29-408d5c0cc128,马粪海胆人工育苗的初步研究,http://rss.cnki.net/rss/Getinfobydoi.aspx?doi=CNKI:SUN:HYHJ.0.2008-06-003,1985
"作为沉积学和盆地研究领域的重要分支,碎屑岩储集层成岩作用研究在短短40年间伴随着实验测试技术的广泛应用而得到迅猛发展,推动了含油气盆地的勘探开发。紧密围绕这一知识体系,概述了成岩作用的概念、研究历史,并归纳整理了国内外具有代表性的成岩阶段划分观点。引入和总结了近年来成岩作用理论和应用方面的研究进展,主要表现为:①碱性成岩作用理论的成熟与完善;②成岩数值模拟技术应用日益广泛;③层序地层/沉积相框架下的成岩作用快速发展;④构造成岩作用的初步探索;⑤成岩相定量评价的深入分析。这些最新的研究成果丰富和充实了现有的成岩作用研究体系和技术系列。进一步探讨了成岩作用学科体系的研究趋势,就致密砂岩储层成岩作用研究、成岩作用系统分级及其时空属性探讨、成岩作用定量化体系研究和成岩作用与其他学科领域交叉融合等研究前沿和发展方向做出展望,以期能带动成岩作用研究深入向前发展,从而为更好地预测和评价含油气碎屑岩储集层的时空分布服务。 ",张金亮|张鹏辉|谢俊|董紫睿|张明|丁芳|袁勇|李景哲,北京师范大学资源学院|首尔大学地球与环境科学学院|山东科技大学地质科学与工程学院|斯伦贝谢中国公司|中国海洋大学海洋地球科学学院,2559,地球科学进展,602d21b4-8417-11e8-b7f3-408d5c0cc128,碎屑岩|成岩作用|成岩演化,11,,碎屑岩储集层成岩作用研究进展与展望,http://rss.cnki.net/rss/Getinfobydoi.aspx?doi=CNKI:SUN:DXJZ.0.2013-09-001,2013
"现今在以岩性和地层等隐蔽油气藏为主要目标的油气勘探实践中发现储集体的质量主要受构造相、沉积相和成岩相的综合影响,在烃源岩和构造等成藏基本地质条件明确的情况下,寻找受成岩相控制的优质储集体是油气勘探工作的重点和难点。目前国内外关于碎屑岩储层成岩相的研究尚处于探索阶段,在成岩相的分类命名方案、定量表征参数等方面尚未完全达成共识,而且缺乏完善的成岩相的地球物理表征方法。在阅读国内外大量文献的基础上,概述了成岩相概念的提出以及发展历程;归纳了成岩相的控制因素、研究内容、划分依据、分类方法、命名方案和定量评价标准;总结了成岩相在油气勘探各个环节中的应用;最后探讨了现阶段成岩相研究中尚存的问题。在此基础上,就未来成岩相研究的发展方向做出展望,以期能有效推动成岩相研究相关的理论和技术的深入发展。 ",赖锦|王贵文|王书南|郑懿琼|吴恒|张永辰,中国石油大学(北京)地球科学学院|中国石油大学(北京)油气资源与探测国家重点实验室|中国石油新疆油田公司新疆克拉玛依采油一厂地质所,2205,地球科学进展,6323427e-8417-11e8-97d8-408d5c0cc128,成岩相|沉积相|储层物性|储层评价与预测,12,602d21b4-8417-11e8-b7f3-408d5c0cc128,碎屑岩储层成岩相研究现状及进展,http://rss.cnki.net/rss/Getinfobydoi.aspx?doi=CNKI:SUN:DXJZ.0.2013-09-001,2013
"松辽盆地长岭凹陷中部上白垩统储层砂岩主要类型为岩屑长石砂岩,经历的成岩作用主要有以机械压实为主的压实作用,碳酸盐、粘土矿物、硅酸盐及硅质胶结为主的胶结作用,以长石、岩屑等不稳定组分溶解为主的溶蚀作用和局部发育的交代作用。研究区储层孔隙类型以粒间孔隙、粒内溶孔和铸模孔为主,其中粒间孔隙最为发育。储层砂岩成岩演化阶段处于早成岩B期―中成岩B期,主要为中成岩A期。结合沉积相和成岩作用特征,深入探讨了适合本区的成岩相的划分方案,划分的主要成岩相类型为压实成岩相、碳酸盐胶结相、不稳定组分溶蚀相、硅质胶结相和钠长石成岩相,成岩相决定储层的性能,不稳定组分溶蚀相和钠长石成岩相构成了本区的有利成岩相带。 ",张鹏辉|张金亮|董紫睿|李德勇|任伟伟|罗忠琴,北京师范大学资源学院|斯伦贝谢中国公司成都基地|中国海洋大学海洋地球科学学院,280,矿物岩石,64c33974-8417-11e8-a858-408d5c0cc128,松辽盆地|长岭凹陷中部|上白垩统|成岩作用|成岩相,8,602d21b4-8417-11e8-b7f3-408d5c0cc128,松辽盆地长岭凹陷中部上白垩统砂岩成岩作用及成岩相带,http://rss.cnki.net/rss/Getinfobydoi.aspx?doi=CNKI:SUN:DXJZ.0.2013-09-001,2012
"埋藏条件下原生孔隙的破坏与保存机制是含油气盆地砂岩储层质量研究的一个核心领域,其在油气地质学研究中的意义不言而喻。与次生孔隙的形成与保存机制相比,影响原生孔隙破坏与保存的因素有着其特殊的复杂性和多样性。在总结国内外研究进展的基础上,试图深入理解不同成岩机制在砂岩储层原生孔隙破坏与保存中的意义和作用,包括破坏机制(如机械压实、胶结作用等)和保存机制(如地层超压、颗粒包膜、盐体侵位和烃类占位等)。目前难以实现砂岩储层质量钻前准确预测的一个困难在于无法明确原生孔隙演化的动力和过程,将来成岩作用、流体作用、沉积过程和盆地演化的更紧密结合可能是解决砂岩储层原生孔隙破坏与保存机制研究中最有希望的发展方向之一。 ",胡作维|李云|黄思静|吕杰|朱炳光,成都理工大学油气藏地质及开发工程国家重点实验室沉积地质研究院,844,地球科学进展,6653b01e-8417-11e8-a16a-408d5c0cc128,孔隙演化|成岩作用|储层质量|砂岩储层,12,602d21b4-8417-11e8-b7f3-408d5c0cc128,砂岩储层中原生孔隙的破坏与保存机制研究进展,http://rss.cnki.net/rss/Getinfobydoi.aspx?doi=CNKI:SUN:DXJZ.0.2013-09-001,2012
"利用铸体薄片、阴极发光、扫描电镜等资料,对川中地区上三叠统须家河组储层成岩作用类型及特征进行了综合研究,在此基础上划分成岩相类型,建立了不同类型成岩相测井曲线特征,进行了研究区须家河组成岩相纵向及平面分布研究。结果表明,研究区须家河组碎屑岩储层经历了机械压实、硅质胶结、碳酸盐胶结破坏性成岩作用及溶蚀、绿泥石胶结建设性成岩作用。将储层划分为低孔特低渗溶蚀相、特低孔超低渗压实-溶蚀相、致密强压实相、致密硅质胶结相、致密方解石胶结相5种成岩相类型。低孔特低渗溶蚀相及特低孔超低渗压实-溶蚀相主要分布在须二段、须四段与须六段下部,致密强压实相、致密硅质胶结相、致密方解石胶结相在纵向及横向上封隔有利成岩相,形成岩性圈闭。平面上将川中地区须家河组储集层划分为低孔特低渗溶蚀相、特低孔超低渗压实-溶蚀相及致密强压实相分布区。 ",张响响|邹才能|朱如凯|陶士振|杨式升,中国石油勘探开发研究院,1242,石油学报,68172e98-8417-11e8-9217-408d5c0cc128,川中地区|上三叠统|须家河组|成岩相|成岩作用,8,602d21b4-8417-11e8-b7f3-408d5c0cc128,川中地区上三叠统须家河组储层成岩相,http://rss.cnki.net/rss/Getinfobydoi.aspx?doi=CNKI:SUN:DXJZ.0.2013-09-001,2011
"通过铸体薄片、扫描电镜、镜质体反射率、X衍射、地球化学等分析,对东营凹陷陡坡带沙河街组四段砂岩储层的成岩演化过程进行了系统研究。研究结果表明:沙四段原始沉积环境为碱性盐湖环境,岩石中普遍含钙质和泥质;成岩演化主要受碱性原始沉积环境、层序发育、构造作用、粘土矿物转化、有机质热演化提供的酸性流体等因素的控制,先后发生了原生隐晶方解石胶结→早期绿泥石胶结→石英溶解→长石溶解→石英Ⅱ加大→石英Ⅲ加大→铁碳酸盐胶结→石英及方解石脉充填,后期成岩裂缝比较发育。证实东营凹陷沙四段储层早期主要受碱性水介质的影响,发生了原生隐晶方解石胶结、石英溶解、长石加大等碱性成岩作用;后期受酸性流体的影响,发生了石英次生加大、长石溶蚀、方解石溶蚀等成岩作用。 ",谭先锋|田景春|李祖兵|张守鹏|王伟庆,重庆科技学院|成都理工大学油气藏地质及开发工程国家重点实验室|中国石化胜利油田公司地质科学研究院,913,地质通报,69b7df00-8417-11e8-bf52-408d5c0cc128,山东|东营凹陷|沙河街组四段|碱性|成岩现象|成岩演化,9,602d21b4-8417-11e8-b7f3-408d5c0cc128,碱性沉积环境下碎屑岩的成岩演化――以山东东营凹陷陡坡带沙河街组四段为例,http://rss.cnki.net/rss/Getinfobydoi.aspx?doi=CNKI:SUN:DXJZ.0.2013-09-001,2010
"20世纪60年代由于物理化学动力学的引入和低温低压下矿物相平衡的研究,沉积成岩作用的研究有了突破性的进展,有机地球化学大大促进了沉积成岩作用的研究。现在沉积成岩作用的研究已经成为包括大地构造、盆地分析、沉积学、物理化学、有机地球化学等学科、范围包括大、中、小尺度的各种作用的综合研究。对油气和固体矿产资源的需求促进了沉积成岩作用的深入研究,石油天然气的形成和聚集、储层性质的变化涉及沉积成岩的全过程;一些低温低压的层控固体矿产的富集涉及盆地沉积充填、盆山转化的岩相及流体的动力和物理化学行为,自上世纪70年代以来,研究工作都有重要进展。近年来有关海洋沉积的研究、硅、锰、碳酸盐等沉积物形成、大地构造背景、同位素、有机物形成演化等的成岩过程的研究都有重要进展,也成为研究的热点问题。 ",刘宝B,中国地质调查局成都地质矿产研究所,1934,沉积学报,6b324a42-8417-11e8-b59f-408d5c0cc128,沉积成岩作用,5,602d21b4-8417-11e8-b7f3-408d5c0cc128,沉积成岩作用研究的若干问题,http://rss.cnki.net/rss/Getinfobydoi.aspx?doi=CNKI:SUN:DXJZ.0.2013-09-001,2009
"对成岩作用的物理―化学―生物过程的系统认识已经成为国际成岩作用研究的学术热点,而对沉积盆地尤其是化石能源盆地成岩作用重要性认识的加强,使得对成岩作用时空属性及其界定的精度要求愈来愈高。为此本文明确提出了在盆地动力学演化框架内,基于盆地沉积层序(岩石―矿物―化学体系配置)、埋藏、构造、流体格架分析,开展成岩作用时空分布研究的思路。进一步讨论了成岩作用的动力机制与时空分布研究若干问题和发展趋向,提出了应重视和开展地表温度变化对埋藏成岩作用,沉积结构及其矿物―化学体系对后期成岩改造的制约机理,断裂相、变形条带及其与碎屑岩储层裂缝或强压实改造关系,构造―流体活动耦合机制与流体―岩石相互作用效应等的研究建议。 ",李忠|刘嘉庆,中国科学院地质与地球物理研究所,1359,沉积学报,6cc99576-8417-11e8-b651-408d5c0cc128,成岩作用|成岩时空分布|层序格架|构造格架|流体格架|盆地动力学,12,602d21b4-8417-11e8-b7f3-408d5c0cc128,沉积盆地成岩作用的动力机制与时空分布研究若干问题及趋向,http://rss.cnki.net/rss/Getinfobydoi.aspx?doi=CNKI:SUN:DXJZ.0.2013-09-001,2009
"根据成岩作用和成岩相对储集层发育的控制作用及与储集层分布的关系,探讨成岩相的形成机理、划分方案与评价方法及其在油气勘探中的应用和意义。针对碎屑岩、碳酸盐岩和火山岩等扩容性成岩相,提出了有机酸性水溶解作用、白云石化等8种主要成岩作用机理。划分出9类扩容性成岩相和7类致密化成岩相,提出了反映岩性、成岩作用和孔渗性3个层次内容的""孔渗级别+岩石类型+成岩作用类型""的成岩相命名方案。在成岩相勘探评价中,强调根据沉积相、测井相、地震相和岩心薄片等综合定量预测,提出了""四个步骤""、""三图叠合""的评价方法和成图方式,根据不同成岩相类型的分布预测有利储集体、""甜点""、成岩圈闭及油气成藏。指出了成岩相的发展方向及成岩学的设想和思考。图16表6参31 ",邹才能|陶士振|周慧|张响响|何东博|周川闽|王岚|王雪松|李富恒|朱如凯|罗平|袁选俊|徐春春|杨华,中国石油勘探开发研究院|中国石油天然气集团公司|中国石油西南油气田公司|中国石油长庆油田公司,3432,石油勘探与开发,6ea8e454-8417-11e8-b5bb-408d5c0cc128,成岩相|成因机理|分类命名|评价方法|油气勘探|成岩学,15,602d21b4-8417-11e8-b7f3-408d5c0cc128,成岩相的形成、分类与定量评价方法,http://rss.cnki.net/rss/Getinfobydoi.aspx?doi=CNKI:SUN:DXJZ.0.2013-09-001,2008
"含油气盆地的勘探开发对认识沉积成岩作用和储层发育规律提出了很高的要求。然而,迄今为止沉积学家和石油工程师还很难如认识沉积过程及其结构那样认识盆地尺度或宏观尺度上成岩作用的时空分带。为此,本文探讨了成岩作用类型的时空属性和主控因素等理论问题,提出了成岩系统分级(类)的有关准则,试图以此探索成岩作用时空分布与演变研究的新思路。结合中国东、西部有关中-新生代沉积盆地实例分析,阐述了盆地域(尺度)、层序域、亚层序域、层内域等成岩作用系统的客观存在,并对盆地域、层序域成岩作用系统动力学研究的思路和方法作了进一步阐释。在盆地尺度上成岩作用的时空分布主要与盆地大地构造位置及其控制的温压场、物源、剥蚀-搬运气候背景、埋藏历史、水文体制叠置方式密切关联;层序域成岩作用系统的时空分异则主要取决于埋藏深度、层序结构与宏观物理-化学障、沉积体系(配置)、水文体制。研究认为,成岩系统的层次分析是认识不同类型沉积盆地成岩结构的重要基础,而对于确定的盆地类型而言,盆地尺度水文体制与流体-岩石相互作用研究是解析成岩作用时空属性的关键。成岩系统研究目前还面临许多关键问题亟待解决,如成岩系统及其边界条件的划分:成岩作用系... ",李忠|韩登林|寺建峰,中国科学院地质与地球物理研究所|中国石油天然气集团公司杭州石油地质研究所 北京 100029|杭州 310023,1900,岩石学报,702f4276-8417-11e8-9575-408d5c0cc128,成岩作用系统|时空属性|沉积盆地|层序|储层,14,602d21b4-8417-11e8-b7f3-408d5c0cc128,沉积盆地成岩作用系统及其时空属性,http://rss.cnki.net/rss/Getinfobydoi.aspx?doi=CNKI:SUN:DXJZ.0.2013-09-001,2006
"1990年代以来成岩作用研究在国际沉积学中的地位已经发生重要转变,成岩作用研究群体或""共同体""已经初步形成。从岩石类型、地理-气候环境类型、成岩演化阶段、盆地类型等不同方面,本文概括和论述了成岩作用的知识体系,在此基础上提出了当今含油气盆地成岩作用的核心科学问题,即""盆地动力学过程控制的流体-岩石相互作用系统及其时空演变机制""。围绕该科学问题,并结合本专辑讨论的热点,进一步分析了成岩作用的盆地动力学背景、流体-岩石作用机制和分布、成岩圈闭和成藏条件、油气勘探开发应用等研究前沿及其存在问题,特别针对性地指出了我国含油气盆地成岩作用研究应该加大投入的领域。 ",李忠|陈景山|关平,中国科学院地质与地球物理研究所|西南石油大学资源与环境学院|北京大学地球与空间科学学院 北京 100029|成都610500|北京 100871,2264,岩石学报,71d0717e-8417-11e8-8a8b-408d5c0cc128,成岩作用|科学问题|研究前沿|含油气盆地,10,602d21b4-8417-11e8-b7f3-408d5c0cc128,含油气盆地成岩作用的科学问题及研究前沿,http://rss.cnki.net/rss/Getinfobydoi.aspx?doi=CNKI:SUN:DXJZ.0.2013-09-001,2006
"现今在以岩性和地层等隐蔽油气藏为主要目标的油气勘探实践中发现储集体的质量主要受构造相、沉积相和成岩相的综合影响,在烃源岩和构造等成藏基本地质条件明确的情况下,寻找受成岩相控制的优质储集体是油气勘探工作的重点和难点。目前国内外关于碎屑岩储层成岩相的研究尚处于探索阶段,在成岩相的分类命名方案、定量表征参数等方面尚未完全达成共识,而且缺乏完善的成岩相的地球物理表征方法。在阅读国内外大量文献的基础上,概述了成岩相概念的提出以及发展历程;归纳了成岩相的控制因素、研究内容、划分依据、分类方法、命名方案和定量评价标准;总结了成岩相在油气勘探各个环节中的应用;最后探讨了现阶段成岩相研究中尚存的问题。在此基础上,就未来成岩相研究的发展方向做出展望,以期能有效推动成岩相研究相关的理论和技术的深入发展。 ",赖锦|王贵文|王书南|郑懿琼|吴恒|张永辰,中国石油大学(北京)地球科学学院|中国石油大学(北京)油气资源与探测国家重点实验室|中国石油新疆油田公司新疆克拉玛依采油一厂地质所,2205,地球科学进展,74ba8df4-8417-11e8-9ec5-408d5c0cc128,成岩相|沉积相|储层物性|储层评价与预测,12,602d21b4-8417-11e8-b7f3-408d5c0cc128,碎屑岩储层成岩相研究现状及进展,http://rss.cnki.net/rss/Getinfobydoi.aspx?doi=CNKI:SUN:DXJZ.0.2013-09-001,2013
"松辽盆地长岭凹陷中部上白垩统储层砂岩主要类型为岩屑长石砂岩,经历的成岩作用主要有以机械压实为主的压实作用,碳酸盐、粘土矿物、硅酸盐及硅质胶结为主的胶结作用,以长石、岩屑等不稳定组分溶解为主的溶蚀作用和局部发育的交代作用。研究区储层孔隙类型以粒间孔隙、粒内溶孔和铸模孔为主,其中粒间孔隙最为发育。储层砂岩成岩演化阶段处于早成岩B期―中成岩B期,主要为中成岩A期。结合沉积相和成岩作用特征,深入探讨了适合本区的成岩相的划分方案,划分的主要成岩相类型为压实成岩相、碳酸盐胶结相、不稳定组分溶蚀相、硅质胶结相和钠长石成岩相,成岩相决定储层的性能,不稳定组分溶蚀相和钠长石成岩相构成了本区的有利成岩相带。 ",张鹏辉|张金亮|董紫睿|李德勇|任伟伟|罗忠琴,北京师范大学资源学院|斯伦贝谢中国公司成都基地|中国海洋大学海洋地球科学学院,280,矿物岩石,76502e62-8417-11e8-9af2-408d5c0cc128,松辽盆地|长岭凹陷中部|上白垩统|成岩作用|成岩相,8,602d21b4-8417-11e8-b7f3-408d5c0cc128,松辽盆地长岭凹陷中部上白垩统砂岩成岩作用及成岩相带,http://rss.cnki.net/rss/Getinfobydoi.aspx?doi=CNKI:SUN:DXJZ.0.2013-09-001,2012
"埋藏条件下原生孔隙的破坏与保存机制是含油气盆地砂岩储层质量研究的一个核心领域,其在油气地质学研究中的意义不言而喻。与次生孔隙的形成与保存机制相比,影响原生孔隙破坏与保存的因素有着其特殊的复杂性和多样性。在总结国内外研究进展的基础上,试图深入理解不同成岩机制在砂岩储层原生孔隙破坏与保存中的意义和作用,包括破坏机制(如机械压实、胶结作用等)和保存机制(如地层超压、颗粒包膜、盐体侵位和烃类占位等)。目前难以实现砂岩储层质量钻前准确预测的一个困难在于无法明确原生孔隙演化的动力和过程,将来成岩作用、流体作用、沉积过程和盆地演化的更紧密结合可能是解决砂岩储层原生孔隙破坏与保存机制研究中最有希望的发展方向之一。 ",胡作维|李云|黄思静|吕杰|朱炳光,成都理工大学油气藏地质及开发工程国家重点实验室沉积地质研究院,844,地球科学进展,77dcce7a-8417-11e8-a1be-408d5c0cc128,孔隙演化|成岩作用|储层质量|砂岩储层,12,602d21b4-8417-11e8-b7f3-408d5c0cc128,砂岩储层中原生孔隙的破坏与保存机制研究进展,http://rss.cnki.net/rss/Getinfobydoi.aspx?doi=CNKI:SUN:DXJZ.0.2013-09-001,2012
"利用铸体薄片、阴极发光、扫描电镜等资料,对川中地区上三叠统须家河组储层成岩作用类型及特征进行了综合研究,在此基础上划分成岩相类型,建立了不同类型成岩相测井曲线特征,进行了研究区须家河组成岩相纵向及平面分布研究。结果表明,研究区须家河组碎屑岩储层经历了机械压实、硅质胶结、碳酸盐胶结破坏性成岩作用及溶蚀、绿泥石胶结建设性成岩作用。将储层划分为低孔特低渗溶蚀相、特低孔超低渗压实-溶蚀相、致密强压实相、致密硅质胶结相、致密方解石胶结相5种成岩相类型。低孔特低渗溶蚀相及特低孔超低渗压实-溶蚀相主要分布在须二段、须四段与须六段下部,致密强压实相、致密硅质胶结相、致密方解石胶结相在纵向及横向上封隔有利成岩相,形成岩性圈闭。平面上将川中地区须家河组储集层划分为低孔特低渗溶蚀相、特低孔超低渗压实-溶蚀相及致密强压实相分布区。 ",张响响|邹才能|朱如凯|陶士振|杨式升,中国石油勘探开发研究院,1242,石油学报,79732698-8417-11e8-9f77-408d5c0cc128,川中地区|上三叠统|须家河组|成岩相|成岩作用,8,602d21b4-8417-11e8-b7f3-408d5c0cc128,川中地区上三叠统须家河组储层成岩相,http://rss.cnki.net/rss/Getinfobydoi.aspx?doi=CNKI:SUN:DXJZ.0.2013-09-001,2011
"通过铸体薄片、扫描电镜、镜质体反射率、X衍射、地球化学等分析,对东营凹陷陡坡带沙河街组四段砂岩储层的成岩演化过程进行了系统研究。研究结果表明:沙四段原始沉积环境为碱性盐湖环境,岩石中普遍含钙质和泥质;成岩演化主要受碱性原始沉积环境、层序发育、构造作用、粘土矿物转化、有机质热演化提供的酸性流体等因素的控制,先后发生了原生隐晶方解石胶结→早期绿泥石胶结→石英溶解→长石溶解→石英Ⅱ加大→石英Ⅲ加大→铁碳酸盐胶结→石英及方解石脉充填,后期成岩裂缝比较发育。证实东营凹陷沙四段储层早期主要受碱性水介质的影响,发生了原生隐晶方解石胶结、石英溶解、长石加大等碱性成岩作用;后期受酸性流体的影响,发生了石英次生加大、长石溶蚀、方解石溶蚀等成岩作用。 ",谭先锋|田景春|李祖兵|张守鹏|王伟庆,重庆科技学院|成都理工大学油气藏地质及开发工程国家重点实验室|中国石化胜利油田公司地质科学研究院,913,地质通报,7af8be74-8417-11e8-b442-408d5c0cc128,山东|东营凹陷|沙河街组四段|碱性|成岩现象|成岩演化,9,602d21b4-8417-11e8-b7f3-408d5c0cc128,碱性沉积环境下碎屑岩的成岩演化――以山东东营凹陷陡坡带沙河街组四段为例,http://rss.cnki.net/rss/Getinfobydoi.aspx?doi=CNKI:SUN:DXJZ.0.2013-09-001,2010
"20世纪60年代由于物理化学动力学的引入和低温低压下矿物相平衡的研究,沉积成岩作用的研究有了突破性的进展,有机地球化学大大促进了沉积成岩作用的研究。现在沉积成岩作用的研究已经成为包括大地构造、盆地分析、沉积学、物理化学、有机地球化学等学科、范围包括大、中、小尺度的各种作用的综合研究。对油气和固体矿产资源的需求促进了沉积成岩作用的深入研究,石油天然气的形成和聚集、储层性质的变化涉及沉积成岩的全过程;一些低温低压的层控固体矿产的富集涉及盆地沉积充填、盆山转化的岩相及流体的动力和物理化学行为,自上世纪70年代以来,研究工作都有重要进展。近年来有关海洋沉积的研究、硅、锰、碳酸盐等沉积物形成、大地构造背景、同位素、有机物形成演化等的成岩过程的研究都有重要进展,也成为研究的热点问题。 ",刘宝B,中国地质调查局成都地质矿产研究所,1934,沉积学报,7c6c4a8c-8417-11e8-a343-408d5c0cc128,沉积成岩作用,5,602d21b4-8417-11e8-b7f3-408d5c0cc128,沉积成岩作用研究的若干问题,http://rss.cnki.net/rss/Getinfobydoi.aspx?doi=CNKI:SUN:DXJZ.0.2013-09-001,2009
