abstract_text,authors,authors_orgn,download,journal,key,keywords,page,refer_key,title,url,year
"高邮凹陷北斜坡阜宁组碎屑岩储层以细砂岩和粉砂岩为主 ,砂岩类型主要为长石砂岩、岩屑长石砂岩和少量长石岩屑砂岩。主要成岩矿物类型为粘土矿物、石英和碳酸盐等。储层以次生孔隙发育为主 ,粒间孔隙和骨架颗粒溶孔最为发育。阜宁组成岩演化阶段处于早成岩B期至晚成岩A期。机械压实作用比较明显 ,但次生溶蚀作用亦表现得十分强烈。阜宁组储层性质明显地受到沉积微相和成岩作用的影响。在阜一段三角洲主要砂体微相中 ,沉积物粒度较粗、厚度较大的河道和砂坝砂的储集物性明显优于各种粒度较细、厚度较薄的席状砂体。阜三段三角洲前缘砂体发育 ,水下分流河道和河口砂坝物性最好 ,前缘席状砂及其他侧翼砂体的物性较差。平面上储层性质主要表现为相控特点 ,并具有较好的规律性 ",张金亮|刘宝B|毛凤鸣|常象春,中国海洋大学地球科学学院|山东油气勘探开发工程技术研究中心|中国石化江苏油田公司|山东油气勘探开发工程技术研究中心 山东青岛266003山东油气勘探开发工程技术研究中心山东青岛266510|江苏扬州225009,617,石油学报,5872231e-8415-11e8-8ee8-408d5c0cc128,苏北盆地|高邮凹陷|阜宁组|成岩矿物|成岩作用|次生孔隙|储层性质,7,3d128f2c-8415-11e8-b75b-408d5c0cc128,苏北盆地高邮凹陷北斜坡阜宁组成岩作用及储层特征,http://rss.cnki.net/rss/Getinfobydoi.aspx?doi=CNKI:SUN:QDHY.0.2009-01-025,2003
"乌尔逊凹陷大磨拐河组下部(大二段至大三段)发育着近岸水下扇沉积、扇体由扇报、扇中和扇端组成,其沉积怍用类型为高密度至低密度浊流和碎屑流沉积,可进一步划分为七种不同内部结构的岩相类型。近岸水下扇储层经历了复杂的成岩历史,近源相主要受大气水埋藏成岩作用的影响,而远源相则主要受正常的埋藏成岩作用的影响。此外,片钠铝石的形成与深部岩浆活动有关,由于近岸水下扇不同的沉积类型具有不同的成岩历史和成岩机制,因而其孔隙类型和孔隙结构亦有明显差异。 ",张金亮|沈凤,江汉石油学院,270,石油学报,59f67cf4-8415-11e8-84e0-408d5c0cc128,海拉尔盆地|大磨拐河组|水下扇|储集层特征|沉积岩相|成岩作用|沉积类型|岩石成分|孔隙结构|孔隙类型,13,3d128f2c-8415-11e8-b75b-408d5c0cc128,乌尔逊凹陷大磨拐河组近岸水下扇储层特征,http://rss.cnki.net/rss/Getinfobydoi.aspx?doi=CNKI:SUN:QDHY.0.2009-01-025,1991
"东濮凹陷桥口地区沙三段碎屑岩经历了复杂的成岩历史。砂岩的主要成岩事件有:机械压实、碳酸盐胶结、石英加大、黄铁矿生成、高岭石的形成和转化、绿泥石生成、伊利石沉淀、斜长石的钠长石化、石膏和重晶石的形成,以及沸石矿物的生成和次生孔隙的产生。混层蒙皂石-伊利石化随埋深增加而增强,相邻页岩的成岩演化是砂岩胶结物成分的最重要来源。砂岩的成岩作用主要受沉积相的控制,处于中成岩晚期阶段的沙三段砂岩可划分为四种成岩相:(1)碳酸盐胶结成岩相;(2)石英加大自生成岩相;(3)粘土蚀度成岩相;(4)不稳定碎屑溶蚀成岩相。四种成岩相组成了四种不同的储层类型,储层性质的对比分析对识别致密气层中的油气产层具有重要意义。 ",张金亮|沈凤,江汉石油学院|江汉石油学院 荆州 434102,253,矿物岩石,5b6a6f3e-8415-11e8-8607-408d5c0cc128,成岩作用|成岩相|储层特征|东濮凹陷,9,3d128f2c-8415-11e8-b75b-408d5c0cc128,东濮凹陷桥口地区沙三段碎屑岩成岩作用与储层特征,http://rss.cnki.net/rss/Getinfobydoi.aspx?doi=CNKI:SUN:QDHY.0.2009-01-025,1990
"<正> 砂岩储集岩几乎都是孔隙性储集岩。七十年代以来,国内外对砂岩的孔隙几何学已有了不少专门的研究,人们逐渐认识到,尽管砂岩组份稳定,但在漫长的成岩过程中,由于物理化学条件的改变,岩石经历了一系列成岩变化,砂岩的孔隙类型和孔隙结构相应变得十分复杂。 ",王允诚|杨宝星|黄仰洲,成都地质学院,257,石油实验地质,5cdc8dfe-8415-11e8-8a2d-408d5c0cc128,,8,3d128f2c-8415-11e8-b75b-408d5c0cc128,砂岩储集岩的分类与评价,http://rss.cnki.net/rss/Getinfobydoi.aspx?doi=CNKI:SUN:QDHY.0.2009-01-025,1981
"本文在岩心观察和描述的基础上,结合地震、测井等资料及平面上砂体的分布形态,对惠民凹陷西部沙四下亚段的沉积特征及成因进行了研究。认为研究区沙四下亚段主要发育冲积扇沉积的泥石流扇和辫状河扇两种类型,共识别出了6种沉积微相。宁南断层和无南断层下降盘发育大面积的辫状河扇沉积。砂体垂直岸线分布,延伸距离较远。平面上分布呈扇形,沉积相带分异不明显,主要沉积微相为辫状河道、河道砂坝与河道间沉积。邻近齐广断层断崖处发育泥石流扇沉积,砂体不甚发育,与辫状河扇相比,该沉积类型砾岩富集,扇体规模较小。相带变化比较明显,主要沉积微相为泥石流沉积、河道沉积与漫流沉积。该沉积体系的形成主要受构造活动、古地貌、物源区性质与古气候等因素的影响,断裂活动是该沉积体系形成的决定性因素。 ",张鑫|张金亮,中海油研究总院|北京师范大学资源学院,177,沉积与特提斯地质,5fd02500-8415-11e8-b0a1-408d5c0cc128,惠民凹陷|泥石流扇|辫状河扇|地震相|沉积模式,8,,惠民凹陷西部沙四下亚段冲积扇沉积类型与成因分析,http://rss.cnki.net/rss/Getinfobydoi.aspx?doi=CNKI:SUN:TTSD.0.2011-04-003,2011
"在野外露头观察和对前人研究成果整理的基础上,对浙江丽水老竹盆地白垩纪地层进行了对比和重新划分,并进行了相带划分,识别出河流、湖泊、火山喷发及冲积扇相。老竹盆地在早白垩世经历了三次拉张背景下的断陷盆地沉积-喷发旋回;早白垩中晚期的浙闽运动导致浙西北主体的相对上升、接受剥蚀和浙东南的不均衡沉降,气候由早期的温暖干旱变为晚期的干热环境;至晚白垩世,老竹盆地整体由拉张断陷为主向挤压、隆升为主的构造背景转化。 ",罗来|向芳|田馨|宋见春,成都理工大学沉积地质研究院,123,沉积与特提斯地质,62c5e3a6-8415-11e8-bce1-408d5c0cc128,浙江|老竹盆地|白垩纪|沉积特征|沉积环境,7,5fd02500-8415-11e8-b0a1-408d5c0cc128,浙江丽水老竹盆地白垩系沉积特征及沉积环境,http://rss.cnki.net/rss/Getinfobydoi.aspx?doi=CNKI:SUN:TTSD.0.2011-04-003,2010
"利用钻井岩心、测井及地震资料,对黄骅坳陷孔南地区孔店组孔一下亚段进行岩石学、测井响应及地震反射特征的综合研究,识别出4种岩相组合、4种测井相类型和3种地震相类型;划分出扇中和扇端亚相;建立了冲积扇的垂向沉积序列并探讨了冲积扇的空间展布规律。认为研究区孔一下亚段陡坡带属于干旱气候条件下发育的进积型冲积扇沉积体系类型。冲积扇的研究是孔二段到孔一段古环境变化、古构造及盆地演化的重要证据。 ",兰亚萍|李勇|丘东洲|肖敦清|蒲秀刚|袁淑琴|刘子藏|韩冰|冯镜权,成都理工大学油气藏地质及开发工程国家重点实验室|成都地质矿产研究所|大港油田,630,沉积与特提斯地质,6473390a-8415-11e8-acdc-408d5c0cc128,黄骅坳陷|孔店组|冲积扇,7,5fd02500-8415-11e8-b0a1-408d5c0cc128,黄骅坳陷孔南地区孔店组冲积扇沉积特征及地质意义,http://rss.cnki.net/rss/Getinfobydoi.aspx?doi=CNKI:SUN:TTSD.0.2011-04-003,2009
"澧县凹陷内第四系厚度达200m左右,由早更新世―中更新世中期沉积和全新统组成。早更新世―中更新世中期沉积除顶部为粘土外,主体为砾石层,在凹陷中央夹粉砂、细砂和少量粘土。全新统分布于凹陷南部,为湖冲积粘土。早更新世澧县凹陷区断陷沉降,于河道和冲积扇环境下接受沉积;中更新世凹陷逐渐扩张,沉积范围扩展至凹陷外缘,凹陷主体部位自边缘向中央依次为冲积扇和扇前浅湖环境。中更新世中后期因盆地扩张,自凹陷中央至边缘地带均为静水湖泊环境。中更新世晚期至晚更新世,凹陷及周缘因构造抬升而遭受剥蚀而缺失沉积。全新世凹陷南部受澧水及区域湖面上升影响而发育湖冲积沉积。 ",柏道远|高峰|马铁球|王先辉|彭云益|李纲|周柯军,湖南省地质调查院|中国地质大学地球科学学院,206,沉积与特提斯地质,6629ca4c-8415-11e8-b121-408d5c0cc128,澧县凹陷|第四纪沉积|古地理,12,5fd02500-8415-11e8-b0a1-408d5c0cc128,洞庭盆地澧县凹陷第四纪沉积特征与古地理演化,http://rss.cnki.net/rss/Getinfobydoi.aspx?doi=CNKI:SUN:TTSD.0.2011-04-003,2009
"惠民凹陷沙四上亚段沉积时期,盆地边缘发育三角洲和扇三角洲沉积,受波浪和沿岸流的影响,在中央隆起带滨浅湖区形成了与岸线走向平行或斜交的滩坝砂体和风暴沉积。滩坝沉积成熟度较高,泥质含量少,岩性以中细砂岩和粉砂岩为主,也有少量砾石,砂岩中常见含双壳类化石、生物碎屑和炭屑。滩坝沉积可分为砂坝、砂滩和滩坝间微相,平面上该区滩坝砂体可分为近岸砂滩、近岸砂坝、坝间砂滩、远岸砂坝、远岸砂滩、水下隆起处砂坝和水下隆起处砂滩。此外,受风暴浪的影响,在浪基面和风暴浪基面之间的地带形成风暴沉积,主要由块状层理段、递变层理段、丘状交错层理段、平行层理段和块状泥岩段构成。该组合沉积体系的形成主要受古地形、物源性质、湖平面变化等方面的影响。 ",张鑫|张金亮,中国海洋大学海洋地球科学学院|北京师范大学资源学院,527,沉积学报,67b5b15a-8415-11e8-9155-408d5c0cc128,惠民凹陷|中央隆起带|滩坝|风暴岩|沉积模式,8,5fd02500-8415-11e8-b0a1-408d5c0cc128,惠民凹陷中央隆起带沙四上亚段滩坝与风暴岩组合沉积,http://rss.cnki.net/rss/Getinfobydoi.aspx?doi=CNKI:SUN:TTSD.0.2011-04-003,2009
"广西横县六景火车站南侧,角度不整合覆盖下泥盆统莫丁组和那叫组下段,被新近系大面积覆盖而呈两部分远距离割裂状态的一套""二元结构""特征显著的红色泥砂基底碳酸盐岩粗巨砾岩及其横向相变部分,长期以来未被将其作为一个冲积扇的有机统一体进行研究。经笔者两次实地踏勘,系统采样和分析,以现代山麓冲积扇鉴别特征为主,辅以古冲积扇特征,综合分析认为该套沉积系列相关分割露头分别为一古近系冲积扇所残存扇根、扇中和扇缘。该冲积扇为一典型的古近纪早期干旱气候条件下,母岩区为陡峻碳酸盐岩山体的古山麓冲积扇。 ",刘疆|白志强,北京大学地球与空间科学学院,59,沉积与特提斯地质,69657e52-8415-11e8-ba80-408d5c0cc128,广西|六景|古近系|碳酸盐岩|冲积扇,7,5fd02500-8415-11e8-b0a1-408d5c0cc128,广西横县六景古近纪冲积物研究,http://rss.cnki.net/rss/Getinfobydoi.aspx?doi=CNKI:SUN:TTSD.0.2011-04-003,2008
"在对泌阳凹陷陡坡带砂砾岩体空间展布预测中,以层序地层学研究为基础,依据古地貌沟扇对应理论,利用地震属性分析技术和地震反演技术,寻找砂砾岩扇体并确定其分布边界。预测结果,在陡坡带边界断层附近发现了新的砂砾岩扇体,在深凹区过渡带发现了浊积砂体,均为有利的油气聚集区,经钻探获得了良好效果,对陡坡带砂砾岩体的勘探起到较好的指导作用。图3参10 ",陈萍,中国石化河南油田公司勘探开发研究院,334,石油勘探与开发,6af3cfdc-8415-11e8-8767-408d5c0cc128,陡坡带|砂砾岩体|储集层预测|泌阳凹陷,3,5fd02500-8415-11e8-b0a1-408d5c0cc128,泌阳凹陷陡坡带砂砾岩体预测,http://rss.cnki.net/rss/Getinfobydoi.aspx?doi=CNKI:SUN:TTSD.0.2011-04-003,2006
"利用钻井取心、薄片鉴定、粒度分析、古生物鉴定及测井解释等资料和手段,对济阳坳陷南部古近系孔一段到沙四段底部沉积特征进行研究。结果表明,济阳坳陷在孔一段至沙四段沉积早期处于湖盆裂陷初期,沉积作用明显受季节性洪水注入影响,在东营、惠民两凹陷形成洪水―漫湖沉积体系。其主要岩性特征为:岩石类型以反映氧化环境的浅色碎屑岩类为主,成熟度较低,粒度分布和沉积构造反映其兼有重力流和牵引流的沉积特点,植物碎屑贫乏而生物扰动构造丰富且具周期性,砂体呈环带状分布。该沉积体系分为洪水水道末端、泥坪、砂坪、砂泥混合坪和漫湖风暴等5个微相和侧缘远源、近岸远源两类相层序。 ",袁静,中国石油大学(华东)地球资源与信息学院 山东东营257061,194,中国地质,6c7af870-8415-11e8-b8e5-408d5c0cc128,洪水―漫湖|沉积特征|孔一段|沙四段|济阳坳陷南部,612k,5fd02500-8415-11e8-b0a1-408d5c0cc128,济阳坳陷南部古近系洪水―漫湖沉积,http://rss.cnki.net/rss/Getinfobydoi.aspx?doi=CNKI:SUN:TTSD.0.2011-04-003,2005
"在野外露头观察和对前人研究成果整理的基础上,对浙江丽水老竹盆地白垩纪地层进行了对比和重新划分,并进行了相带划分,识别出河流、湖泊、火山喷发及冲积扇相。老竹盆地在早白垩世经历了三次拉张背景下的断陷盆地沉积-喷发旋回;早白垩中晚期的浙闽运动导致浙西北主体的相对上升、接受剥蚀和浙东南的不均衡沉降,气候由早期的温暖干旱变为晚期的干热环境;至晚白垩世,老竹盆地整体由拉张断陷为主向挤压、隆升为主的构造背景转化。 ",罗来|向芳|田馨|宋见春,成都理工大学沉积地质研究院,123,沉积与特提斯地质,6f7cccec-8415-11e8-ad5a-408d5c0cc128,浙江|老竹盆地|白垩纪|沉积特征|沉积环境,7,5fd02500-8415-11e8-b0a1-408d5c0cc128,浙江丽水老竹盆地白垩系沉积特征及沉积环境,http://rss.cnki.net/rss/Getinfobydoi.aspx?doi=CNKI:SUN:TTSD.0.2011-04-003,2010
"利用钻井岩心、测井及地震资料,对黄骅坳陷孔南地区孔店组孔一下亚段进行岩石学、测井响应及地震反射特征的综合研究,识别出4种岩相组合、4种测井相类型和3种地震相类型;划分出扇中和扇端亚相;建立了冲积扇的垂向沉积序列并探讨了冲积扇的空间展布规律。认为研究区孔一下亚段陡坡带属于干旱气候条件下发育的进积型冲积扇沉积体系类型。冲积扇的研究是孔二段到孔一段古环境变化、古构造及盆地演化的重要证据。 ",兰亚萍|李勇|丘东洲|肖敦清|蒲秀刚|袁淑琴|刘子藏|韩冰|冯镜权,成都理工大学油气藏地质及开发工程国家重点实验室|成都地质矿产研究所|大港油田,630,沉积与特提斯地质,7108424c-8415-11e8-afc3-408d5c0cc128,黄骅坳陷|孔店组|冲积扇,7,5fd02500-8415-11e8-b0a1-408d5c0cc128,黄骅坳陷孔南地区孔店组冲积扇沉积特征及地质意义,http://rss.cnki.net/rss/Getinfobydoi.aspx?doi=CNKI:SUN:TTSD.0.2011-04-003,2009
"澧县凹陷内第四系厚度达200m左右,由早更新世―中更新世中期沉积和全新统组成。早更新世―中更新世中期沉积除顶部为粘土外,主体为砾石层,在凹陷中央夹粉砂、细砂和少量粘土。全新统分布于凹陷南部,为湖冲积粘土。早更新世澧县凹陷区断陷沉降,于河道和冲积扇环境下接受沉积;中更新世凹陷逐渐扩张,沉积范围扩展至凹陷外缘,凹陷主体部位自边缘向中央依次为冲积扇和扇前浅湖环境。中更新世中后期因盆地扩张,自凹陷中央至边缘地带均为静水湖泊环境。中更新世晚期至晚更新世,凹陷及周缘因构造抬升而遭受剥蚀而缺失沉积。全新世凹陷南部受澧水及区域湖面上升影响而发育湖冲积沉积。 ",柏道远|高峰|马铁球|王先辉|彭云益|李纲|周柯军,湖南省地质调查院|中国地质大学地球科学学院,206,沉积与特提斯地质,729f0240-8415-11e8-aeed-408d5c0cc128,澧县凹陷|第四纪沉积|古地理,12,5fd02500-8415-11e8-b0a1-408d5c0cc128,洞庭盆地澧县凹陷第四纪沉积特征与古地理演化,http://rss.cnki.net/rss/Getinfobydoi.aspx?doi=CNKI:SUN:TTSD.0.2011-04-003,2009
"惠民凹陷沙四上亚段沉积时期,盆地边缘发育三角洲和扇三角洲沉积,受波浪和沿岸流的影响,在中央隆起带滨浅湖区形成了与岸线走向平行或斜交的滩坝砂体和风暴沉积。滩坝沉积成熟度较高,泥质含量少,岩性以中细砂岩和粉砂岩为主,也有少量砾石,砂岩中常见含双壳类化石、生物碎屑和炭屑。滩坝沉积可分为砂坝、砂滩和滩坝间微相,平面上该区滩坝砂体可分为近岸砂滩、近岸砂坝、坝间砂滩、远岸砂坝、远岸砂滩、水下隆起处砂坝和水下隆起处砂滩。此外,受风暴浪的影响,在浪基面和风暴浪基面之间的地带形成风暴沉积,主要由块状层理段、递变层理段、丘状交错层理段、平行层理段和块状泥岩段构成。该组合沉积体系的形成主要受古地形、物源性质、湖平面变化等方面的影响。 ",张鑫|张金亮,中国海洋大学海洋地球科学学院|北京师范大学资源学院,527,沉积学报,7452e99e-8415-11e8-80a6-408d5c0cc128,惠民凹陷|中央隆起带|滩坝|风暴岩|沉积模式,8,5fd02500-8415-11e8-b0a1-408d5c0cc128,惠民凹陷中央隆起带沙四上亚段滩坝与风暴岩组合沉积,http://rss.cnki.net/rss/Getinfobydoi.aspx?doi=CNKI:SUN:TTSD.0.2011-04-003,2009
"广西横县六景火车站南侧,角度不整合覆盖下泥盆统莫丁组和那叫组下段,被新近系大面积覆盖而呈两部分远距离割裂状态的一套""二元结构""特征显著的红色泥砂基底碳酸盐岩粗巨砾岩及其横向相变部分,长期以来未被将其作为一个冲积扇的有机统一体进行研究。经笔者两次实地踏勘,系统采样和分析,以现代山麓冲积扇鉴别特征为主,辅以古冲积扇特征,综合分析认为该套沉积系列相关分割露头分别为一古近系冲积扇所残存扇根、扇中和扇缘。该冲积扇为一典型的古近纪早期干旱气候条件下,母岩区为陡峻碳酸盐岩山体的古山麓冲积扇。 ",刘疆|白志强,北京大学地球与空间科学学院,59,沉积与特提斯地质,75d88ce4-8415-11e8-9b6b-408d5c0cc128,广西|六景|古近系|碳酸盐岩|冲积扇,7,5fd02500-8415-11e8-b0a1-408d5c0cc128,广西横县六景古近纪冲积物研究,http://rss.cnki.net/rss/Getinfobydoi.aspx?doi=CNKI:SUN:TTSD.0.2011-04-003,2008
"在对泌阳凹陷陡坡带砂砾岩体空间展布预测中,以层序地层学研究为基础,依据古地貌沟扇对应理论,利用地震属性分析技术和地震反演技术,寻找砂砾岩扇体并确定其分布边界。预测结果,在陡坡带边界断层附近发现了新的砂砾岩扇体,在深凹区过渡带发现了浊积砂体,均为有利的油气聚集区,经钻探获得了良好效果,对陡坡带砂砾岩体的勘探起到较好的指导作用。图3参10 ",陈萍,中国石化河南油田公司勘探开发研究院,334,石油勘探与开发,7752b992-8415-11e8-a9de-408d5c0cc128,陡坡带|砂砾岩体|储集层预测|泌阳凹陷,3,5fd02500-8415-11e8-b0a1-408d5c0cc128,泌阳凹陷陡坡带砂砾岩体预测,http://rss.cnki.net/rss/Getinfobydoi.aspx?doi=CNKI:SUN:TTSD.0.2011-04-003,2006
"利用钻井取心、薄片鉴定、粒度分析、古生物鉴定及测井解释等资料和手段,对济阳坳陷南部古近系孔一段到沙四段底部沉积特征进行研究。结果表明,济阳坳陷在孔一段至沙四段沉积早期处于湖盆裂陷初期,沉积作用明显受季节性洪水注入影响,在东营、惠民两凹陷形成洪水―漫湖沉积体系。其主要岩性特征为:岩石类型以反映氧化环境的浅色碎屑岩类为主,成熟度较低,粒度分布和沉积构造反映其兼有重力流和牵引流的沉积特点,植物碎屑贫乏而生物扰动构造丰富且具周期性,砂体呈环带状分布。该沉积体系分为洪水水道末端、泥坪、砂坪、砂泥混合坪和漫湖风暴等5个微相和侧缘远源、近岸远源两类相层序。 ",袁静,中国石油大学(华东)地球资源与信息学院 山东东营257061,194,中国地质,78d0b880-8415-11e8-a359-408d5c0cc128,洪水―漫湖|沉积特征|孔一段|沙四段|济阳坳陷南部,612k,5fd02500-8415-11e8-b0a1-408d5c0cc128,济阳坳陷南部古近系洪水―漫湖沉积,http://rss.cnki.net/rss/Getinfobydoi.aspx?doi=CNKI:SUN:TTSD.0.2011-04-003,2005
"东营―惠民凹陷隶属渤海湾盆地,位于济阳坳陷的南部,古新统和始新统的下部的孔店组中已获工业性油气流。孔店组的含油气远景与控制形成油气藏各要素的孔店期盆地原型密切相关。该文通过分析构造演化剖面沉积相图,认为孔店期原型盆地为北断南超的伸展半地堑,盆地长轴方向整体为近东西向,主要的控制性断层是北东东向的宁南断层、无南断层西段和陈南断层西段,北西向的陈南断层东段、无南断层东段和石村断层有重要影响。北西向构造的影响在东部大于西部,孔店早期大于晚期。太平洋板块向欧亚板块俯冲以及亚洲东部大陆边缘由安第斯型向西太平洋型转化导致上地幔隆升作用的加剧和郯庐断层由左旋走滑向右旋走滑的转化是东营―惠民凹陷孔店期盆地发育地球动力学背景。 ",谭明友,中国石化胜利油田有限公司物探研究院 山东东营　257022,439,石油实验地质,7bd15bdc-8415-11e8-b1c2-408d5c0cc128,半地堑|盆地原型|古始新世|东营―惠民凹陷|渤海湾盆地,5,5fd02500-8415-11e8-b0a1-408d5c0cc128,渤海湾盆地东营-惠民凹陷孔店期原型盆地分析,http://rss.cnki.net/rss/Getinfobydoi.aspx?doi=CNKI:SUN:TTSD.0.2011-04-003,2003
"利用岩心、录井、粒度及古生物等资料 ,对惠民凹陷西部下第三系沙四段下部沉积特征进行了研究。结果表明 ,惠民凹陷西部沙四段下部发育洪水漫湖沉积。其主要特征为 :①岩石具有较高成分成熟度和较低结构成熟度 ;②发育重力流和牵引流兼而有之的沉积构造类型 ;③有丰富的生物扰动构造 ;④具条带状延伸的砂体形态。洪水漫湖沉积主要发育有洪水水道、洪水漫湖砂坪、洪水漫湖砂泥混合坪、洪水漫湖泥坪和漫湖风暴 5种沉积类型 ,根据平面及剖面特征建立了沉积相模式。洪水水道及洪水漫湖砂坪沉积具有良好的储集性能 ,是惠民凹陷深层勘探开发的重要领域 ",杨剑萍|操应长,石油大学地球资源与信息学院|石油大学地球资源与信息学院 山东东营257061,281,石油大学学报(自然科学版),7d82363e-8415-11e8-a53b-408d5c0cc128,惠民凹陷|下第三系|沙四段|洪水-漫湖|沉积特征|沉积模式,6,5fd02500-8415-11e8-b0a1-408d5c0cc128,惠民凹陷西部下第三系沙四段下部洪水-漫湖沉积特征,http://rss.cnki.net/rss/Getinfobydoi.aspx?doi=CNKI:SUN:TTSD.0.2011-04-003,2002
"东营凹陷下第三系沙四段广泛发育的蒸发岩类与暗色泥、页岩和深水浊积砂体呈现明显韵律层 ,为厚度达千米的盐湖沉积。通过分析了该地区蒸发岩地层的沉积特征和沉积条件 ,认为东营凹陷沙四段蒸发岩类的物质基础是深层卤水 ;深部古老地层中的盐类物质是其盐源 ;凹陷中北部的同沉积深大断裂是沟通凹陷与地壳深部盐类物质的通道。在此基础上提出东营凹陷沙四段盐湖的深水成因模式 ,可与东非裂谷基伍湖和东濮凹陷下第三系深水成因盐湖对比 ",袁静|赵澄林|张善文,石油大学资源科学系!山东东营257062|石油大学!北京昌平102200|胜利油田地质研究院!山东东营257000,595,沉积学报,7f331e5e-8415-11e8-81f2-408d5c0cc128,东营凹陷沙四段|盐湖|深水成因模式,5,5fd02500-8415-11e8-b0a1-408d5c0cc128,东营凹陷沙四段盐湖的深水成因模式,http://rss.cnki.net/rss/Getinfobydoi.aspx?doi=CNKI:SUN:TTSD.0.2011-04-003,2000
"剩余油研究是油田开发中后期油藏管理的主要任务,是实现""控水稳油""开发战略的重要手段。油田进入高含水后期开发后,随着开采程度加深,地下油水关系越来越复杂,非均质更严重,剩余油分布越来越复杂,给油田稳产和调整挖潜带来的难度越来越大。在结合项目研究成果及大量文献检索的基础上,阐述了我国剩余油研究的发展现状、主要技术及分布模式,归纳总结了剩余油的研究进展。 ",刘宝B|谢俊|张金亮,山东省油气勘探开发工程技术研究中心|山东省油气勘探开发工程技术研究中心 山东青岛　266510|山东青岛　266510山东科技大学山东泰安　610059|山东青岛　266510中国海洋大学山东青岛　266003,1939,西北地质,8209e43e-8415-11e8-a6fb-408d5c0cc128,高含水油藏|剩余油|研究现状|油藏描述,6,,我国剩余油技术研究现状与进展,http://rss.cnki.net/rss/Getinfobydoi.aspx?doi=CNKI:SUN:XBDI.0.2004-04-001,2004
